"id","name","subcategory","description","imageUrl","keywords"
"0f638b44-1208-4a3e-bc87-04a57b7dd7d1","English Scotch Drink Packaging Die-line Template Cardboard","Alcoholic Beverages","This structural die-line template for English Scotch drink packaging is designed for cardboard material. It includes fold and glue flaps for straightforward assembly and is fully optimized for print production. Perfect for beverage branding, marketing campaigns, and retail displays, it helps products stand out effectively.","https://brandex-cdn.b-cdn.net/PACKAGING/Brandex 9-10-2025/Neveria English Scotch Drink/Neveria English Scotch Drink.jpeg","English Scotch packaging; alcohol beverage box; drink structural packaging; bottle; beverage container"
"24befaec-7e31-462a-ab09-4d48e7df2317","Visa Card Box Packaging Structural EPS Die-line Template","Payment & Gift Cards","This EPS file provides a meticulously crafted structural packaging die-line for Visa or credit card boxes. Optimized for print production, it includes detailed cut and fold lines, ensuring precise assembly and a flawless presentation for your card products. Perfect for branding agencies, designers, and businesses creating impactful, print-ready packaging that elevates corporate identity and enhances product presentation. Showcases a clean, modern aesthetic.","https://brandex-cdn.b-cdn.net/PACKAGING/Brandex 9-10-2025/Visa Card Packaging 9/Visa Card Packaging 9.jpeg","Visa card box packaging; EPS structural die-line; Print-ready folding carton; Credit card brand presentation; Gift card holder design"
"defdd87a-eb3b-43ad-b8ec-121d0972c3b7","Visa Debit Credit Card EPS Packaging Die-Line Template","Payment & Gift Cards","Professional packaging template for Visa debit or credit cards. Features a sleek, print-optimized layout with a detailed die-line and fold guide for accurate assembly. Customizable for financial institutions and branding agencies to enhance corporate identity and showcase financial products elegantly.","https://brandex-cdn.b-cdn.net/PACKAGING/Brandex 9-10-2025/Visa Card Packaging 6/Visa Card Packaging 6.jpeg","visa card packaging; eps vector format; die-line guide; financial institution branding; credit card packaging"
"015208ba-030a-4069-b82b-b433826b56a7","Visa Card Packaging Die-Line Template Print-Ready Holder Structure","Payment & Gift Cards","Precision die-line template for Visa card holders, featuring standard dimensions and fold & glue flaps for seamless assembly. Perfect for packaging designers seeking print-ready, functional solutions. Optimized for various materials to enhance branding and meet industry standards.","https://brandex-cdn.b-cdn.net/PACKAGING/Brandex 9-10-2025/Visa Card Packaging 8/Visa Card Packaging 8.jpeg","visa card packaging; die-line template; card holder structure; print ready artwork; custom card packaging"
"67f7882c-a63b-4e83-a92a-9c5b73b74e45","Cigarette Box Packaging Template Die-Line Cardboard Structural Print-Ready","Cigarettes, Vape & Gum","This die-line template provides the structural design for a cigarette box, crafted from cardboard. Ideal for branding agencies and product designers, it enables precise customization and visualization of packaging concepts. The template is print production ready, ensuring seamless translation of designs into physical products for showcasing brand identity and enhancing market presence.","https://brandex-cdn.b-cdn.net/PACKAGING/Brandex 9-10-2025/MARKOS Cigarettes Inner 2/MARKOS Cigarettes Inner 2.jpeg","cigarette box die-line; cardboard packaging template; structural packaging design; print ready box; product branding mockup"
"ed93781d-a2b9-461b-8760-9f7d397748b0","Visa Card Packaging Die-Line EPS Template Print-Ready Layout","Payment & Gift Cards","This EPS template provides a precise die-line layout for Visa card packaging. It includes accurate dimensions and fold lines, ensuring a professional, print-ready solution for financial sector designers and packaging engineers. Optimize card presentations while maintaining brand integrity across various materials.","https://brandex-cdn.b-cdn.net/PACKAGING/Brandex 9-10-2025/Visa Card Packaging 5/Visa Card Packaging 5.jpeg","Visa card packaging; EPS die-line template; Financial card box; Print-ready packaging; Card dimensions layout"
"9fecb711-caf0-400b-9a3e-806f5be91d4c","Plastic Cream Tub Packaging Die-Line for Cosmetics Food","Cosmetics & Personal Care","This cream tub packaging solution provides a detailed die-line for cosmetic or food products. Optimized for print production, it includes fold & glue flaps, ensuring structural integrity for a professional finish. Ideal for branding agencies and product designers seeking a market-ready package to highlight brand identity and product presentation.","https://brandex-cdn.b-cdn.net/PACKAGING/Brandex 9-10-2025/Brandex Cream Tub Pakaging/Brandex Cream Tub Pakaging.jpeg","plastic cream tub; cosmetic product container; food container die-line; structural die-line artwork; fold glue carton"
"b439d8d0-f1a3-430b-8f87-060e4f1a7310","Cigarette Box Packaging Die-line Template for Cardboard Print-Ready","Cigarettes, Vape & Gum","This print-ready structural die-line template is for creating cigarette packaging from cardboard. It includes detailed fold and glue flaps, ensuring a seamless assembly process for packaging engineers. An essential resource for producing high-quality cigarette boxes that meet industry standards and enhance brand identity.","https://brandex-cdn.b-cdn.net/PACKAGING/Brandex 9-10-2025/MOTAX Cigarettes Inner/MOTAX Cigarettes Inner.jpeg","cigarette box die-line; cardboard packaging structural; print production ready; fold glue flap; cigarette carton layout"
"3d87caf7-e796-479b-9679-ce5cd1df524b","Summer Drink Cardboard Box Packaging Template Die-line","Juice & Water","Elevate your beverage brand with this sleek cardboard box packaging template. Features precise die-lines, fold and glue flaps for secure closure, and is fully print production ready. Ideal for summer drinks, juices, or flavored waters, ensuring your product stands out with its vibrant, functional design and easy assembly. Perfect for retail presentation.","https://brandex-cdn.b-cdn.net/PACKAGING/Brandex 9-10-2025/Robinsons Summer Drink Packaging/Robinsons Summer Drink Packaging.jpeg","summer beverage packaging; cardboard box template; packaging die-line; print ready structure; foldable drink container"
"894a3f0e-9f2b-42d8-96d2-2aec4b11b717","Print Ready Product Packaging Label Design Template Editable","Other / Uncategorized","This editable packaging label template is designed for seamless integration into your product branding projects. It features a clean, customizable layout optimized for high-quality, vibrant printing. Enhance your product's shelf appeal and effectively communicate brand identity, perfect for businesses aiming to elevate their packaging strategy with a polished look.","https://brandex-cdn.b-cdn.net/PACKAGING/Brandex 9-10-2025/Label Design/Label Design.jpeg","Print Ready; Product Label; Packaging Design; Customizable Label; Die Line"
"ffc56498-56c3-4c69-970e-6961f8c9b925","Kraft Chocolate Peanut Butter Food Packaging Dieline Template","Chocolate & Confectionery","Enhance your chocolate peanut butter product presentation with this customizable Kraft material packaging template. It includes precise die-lines and fold flaps, ensuring seamless production and a striking visual impact for retail shelves. Perfect for food brands and designers seeking a professional box structure for their products.","https://brandex-cdn.b-cdn.net/PACKAGING/Brandex 9-10-2025/Canvas Chocolate Peanut Butter Packaging/Canvas Chocolate Peanut Butter Packaging.jpeg","chocolate peanut butter; kraft food packaging; packaging dieline template; box structural design; customizable retail packaging"
"d56f0967-1c97-4c6a-a797-3ad8e4a67003","Dark Chocolate Bar Packaging Mockup Smart Object Matte Finish","Chocolate & Confectionery","Showcase your dark chocolate branding with this high-resolution packaging mockup. Featuring a sophisticated matte finish and rich textures, it is perfect for presentations and marketing. Easily replace the label design using the included Smart Object layer for seamless integration and print-ready results. Ideal for luxury food product visualization.","https://brandex-cdn.b-cdn.net/PACKAGING/Brandex 9-10-2025/SensatioN Dark Chocolate Packaging & Mockup/SensatioN Dark Chocolate Packaging & Mockup.jpeg","dark chocolate packaging; chocolate bar mockup; matte finish packaging; smart object label; food packaging presentation"
"599196a8-7562-4b39-a4b4-0a35326eb95f","Vibrant Plastic Berry Juice Bottle Packaging Template","Juice & Water","Design compelling beverage packaging for berry juice with this vector template. It features a vibrant layout and includes a detailed die-line for precise cutting and folding, ensuring structural integrity for plastic bottles. Ideal for designers creating standout retail packaging for fruit drinks, enhancing brand visibility.","https://brandex-cdn.b-cdn.net/PACKAGING/Brandex 9-10-2025/Brandex Sun Shine Berry Bottle Juice Packaging2/Brandex Sun Shine Berry Bottle Juice Packaging2.jpeg","Berry Juice Bottle; Plastic Packaging; Beverage Branding; Die-line Template; Fruit Juice Label"
"313cbfca-5bc3-44e9-b944-87718c8021d7","Vibrant Melon Juice Bottle Packaging Die-line Template","Juice & Water","Showcase your melon-flavored beverage with this vibrant and refreshing packaging solution. This template includes detailed die-lines and precise fold flaps, ensuring a perfect fit for production. Tailored for beverage brands, it's print-ready and crafted for high-quality presentation, enhancing any product launch.","https://brandex-cdn.b-cdn.net/PACKAGING/Brandex 9-10-2025/Brandex Sun Shine Melon Bottle Juice Packaging1/Brandex Sun Shine Melon Bottle Juice Packaging1.jpeg","Melon Juice Bottle; Beverage Packaging; Print Ready Die-line; Fold Flaps Layout; Vibrant Refreshing Label"
"273d0a1c-631b-4eff-baa8-842524c44dd1","Orange Juice Beverage Bottle Packaging Template Die-line Print-Ready Glossy","Juice & Water","This orange juice bottle packaging template offers a vibrant design with a glossy finish, perfect for beverage brands. It includes a precise die-line for seamless print production, ensuring accurate cutting and folding. Elevate your product's shelf appeal, making your juice bottles stand out with a fresh and professional presentation.","https://brandex-cdn.b-cdn.net/PACKAGING/Brandex 9-10-2025/Brandex Sun Shine Orange Bottle Juice Packaging3/Brandex Sun Shine Orange Bottle Juice Packaging3.jpeg","juice bottle packaging; orange beverage packaging; packaging die-line template; print ready packaging; food product packaging"
"1d99a3c4-de06-40c9-87c6-81b959530067","Cigarette Inner Packaging Cardboard Die-Line Template","Cigarettes, Vape & Gum","This die-line template for cigarette inner packaging is made from cardboard. It features precise fold and glue flaps, perfect for seamless assembly and professional presentation. Ideal for branding agencies and packaging engineers to visualize brand identity, this design is print-ready for effective market impact.","https://brandex-cdn.b-cdn.net/PACKAGING/Brandex 9-10-2025/QUANTY Cigarettes Inner/QUANTY Cigarettes Inner.jpeg","cigarette packaging; inner box die-line; cardboard template; fold and glue packaging; tobacco branding mockup"
"8893ab0e-e138-4dd2-8c57-4b6a23235a38","Skrilix Cigarettes Inner Box Die-Line Vector Template","Cigarettes, Vape & Gum","This detailed die-line template for inner cigarette packaging is crafted in Adobe Illustrator. Engineered for precision, it ensures accurate cuts and folds for production. Ideal for designers and branding agencies, it offers a robust, customizable framework for unique brand identity integration and material specification, perfect for premium product presentations.","https://brandex-cdn.b-cdn.net/PACKAGING/Brandex 9-10-2025/SKRILIX Cigarettes Inner/SKRILIX Cigarettes Inner.jpeg","cigarette packaging; inner box template; die-line vector; Adobe Illustrator; customizable packaging"
"e390b694-251e-4f33-91f6-7c4719723f21","Cardboard Cigarette Inner Box Die-line Template","Cigarettes, Vape & Gum","This detailed packaging template features precise fold and glue flaps for seamless assembly of cigarette inner boxes. Designed for optimal material use and print production readiness, it's ideal for branding agencies developing sophisticated tobacco product packaging solutions. Ensure a premium presentation for your brand identity.","https://brandex-cdn.b-cdn.net/PACKAGING/Brandex 9-10-2025/SONDRO Cigarettes Inner/SONDRO Cigarettes Inner.jpeg","cigarette inner box; cardboard die-line; fold glue flaps; print production template; tobacco product packaging"
"6da32a30-9b31-4834-bdd7-cce161382299","Christmas Holiday Chocolate Bar Packaging EPS Template","Chocolate & Confectionery","This EPS packaging template is perfect for confectionery brands creating Christmas-themed chocolate bars. It features vibrant holiday colors and intricate graphics to enhance festive appeal. The print-ready design ensures your product stands out on retail shelves, ideal for seasonal promotions or gift packaging.","https://brandex-cdn.b-cdn.net/PACKAGING/Brandex 9-10-2025/Christmas Brandex Chocolate Bar Packaging 31/Christmas Brandex Chocolate Bar Packaging 31.jpg","Christmas chocolate packaging; Holiday confectionery design; Print-ready chocolate box; EPS food packaging; Gift chocolate bar wrap"
"28280728-1cdd-4665-b7ce-f2a37a83eec6","Bird Food Kraft Paper Packaging Die-line Foldable Box Template","Pet & Bird Food","This professional die-line template provides a sleek design for bird food packaging, crafted from high-quality Kraft paper. It includes fold and glue flaps, ensuring easy assembly and structural integrity. Ideal for branding and marketing bird food products, this print-ready template enhances retail shelf appeal.","https://brandex-cdn.b-cdn.net/PACKAGING/Brandex-21-Dec/Birds Food Packaging 4/Birds Food Packaging 4.jpg","bird food packaging; kraft paper box; dieline template; fold and glue box; eco-friendly packaging"
"6e8c615f-7247-410e-8f84-dffb01248c23","Christmas Coffee Box Packaging EPS Template - Festive Holiday Theme","Coffee","Elevate your coffee product's seasonal appeal with this festive Christmas packaging solution. Designed as a print-ready EPS file, it features intricate holiday graphics and a structured layout. Ensure your coffee brand makes a memorable impression with die-line specifications for easy assembly. Ideal for seasonal promotions and gift coffee branding.","https://brandex-cdn.b-cdn.net/PACKAGING/Brandex 9-10-2025/Christmas Brandex Coffee Packaging 3/Christmas Brandex Coffee Packaging 3.jpg","Christmas coffee box; Holiday gift packaging; EPS vector artwork; Coffee brand identity; Print production ready"
"ce07243b-656b-4772-ab87-0e77d8917d01","Christmas Holiday Gift Box Packaging EPS Vector Die-Line Template","Gift Wrap & Holiday","Enhance your holiday promotions with this beautifully crafted Christmas gift box design. This EPS vector template includes a precise die-line with fold and glue flaps, ensuring seamless and easy assembly. It's perfect for creating festive packaging that elevates product presentation and brand identity, ideal for designers seeking memorable holiday gift solutions.","https://brandex-cdn.b-cdn.net/PACKAGING/Brandex 9-10-2025/Christmas Brandex Gift Box Packaging 2 /Christmas Brandex Gift Box Packaging 2 .jpg","christmas gift box; holiday packaging; EPS vector; packaging die-line; foldable box template"
"b2db1702-6d61-41a4-998c-7b7d61b17e44","Sleek Cherry Herbal Tea Packaging Vector Template for Retail","Tea","This professional product packaging asset for herbal tea features a sleek, modern layout optimized for retail presentation. Created in vector format, it allows for easy customization and scalability, ensuring high-quality print results. Ideal for designers and brands creating appealing product identity, this resource includes essential die-line specifications, making it print production ready for various packaging formats.","https://brandex-cdn.b-cdn.net/PACKAGING/Brandex-21-Dec/Brandex Herbal tea Cherry2/Herbal tea Cherry.jpg","cherry herbal tea; retail packaging; die-line; tea packaging; food packaging"
"cd0d2540-13c4-4b7a-a48d-3b27ffa033da","Birds Food Packaging Box Die-Line Template Eco-Friendly Kraft Material","Pet & Bird Food","This professional die-line for packaging features eco-friendly Kraft material, perfect for bird food and pet product boxes. It includes precise fold and glue flaps for easy assembly and a professional finish. Ideal for designers creating sustainable, print-ready packaging solutions that enhance shelf presence and brand appeal. Customizable for various product dimensions.","https://brandex-cdn.b-cdn.net/PACKAGING/Brandex-21-Dec/Birds Food Packaging 2/Birds Food Packaging 2.jpg","bird feed packaging; kraft die-line structure; eco-friendly box; fold glue packaging; pet food"
"3b9d150e-2658-43e5-afe5-40ab442e3e6b","Blueberry Herbal Tea Packaging Vector Die-line Print Template","Tea","Elevate your product with this vector packaging die-line, specifically designed for herbal tea featuring a delightful blueberry theme. It includes precise fold and glue flaps for seamless assembly and is fully customizable. This print-ready template is ideal for brands seeking a sophisticated, nature-inspired aesthetic for their food product packaging.","https://brandex-cdn.b-cdn.net/PACKAGING/Brandex-21-Dec/Brandex Herbal tea Blueberry2/Herbal tea Blueberry.jpg","herbal tea packaging; blueberry product box; vector die-line template; print production ready; fold glue flaps"
"203842a5-d4d7-4bf9-a2d7-4f0095c0d1f6","Tuck-Top Coffee Box Packaging Template Cardboard Die-line Print-Ready","Coffee","Seamless packaging solution for coffee brands and retailers. This tuck-top box features a clean, print-optimized cardboard die-line with standard dimensions. Ideal for branding agencies and coffee roasters, it allows easy customization to elevate your brand identity. Perfect for retail displays and e-commerce applications, ensuring your product stands out with professional presentation.","https://brandex-cdn.b-cdn.net/PACKAGING/Brandex-21-Dec/coffe14/coffe14.jpg","coffee packaging box; tuck-top cardboard box; die-line packaging layout; retail coffee packaging; coffee house"
"cfc91c2e-5aad-4569-a4a1-480ff1c99c05","Print-Ready Vector Strawberry Herbal Tea Packaging Label Template","Tea","This vector packaging solution provides a print-ready layout with clear die-lines, perfect for designing eye-catching labels for strawberry herbal tea products. Ideal for food and beverage branding projects, it ensures high-quality production with scalable graphics and vibrant colors reflecting natural essence. Quickly create professional product displays.","https://brandex-cdn.b-cdn.net/PACKAGING/Brandex-21-Dec/Brandex Herbal tea Strawberry2/Herbal tea Strawberry.jpg","strawberry herbal tea; vector packaging; food product label; print ready artwork; beverage branding"
"ed8f4b4a-a7b5-47bb-8ad8-cf2d9891940f","Herbal Tea Watermelon Packaging Template Vector Die-line","Tea","This vibrant watermelon-themed package is ideal for herbal tea products. The vector file features clean paths and is infinitely scalable, ensuring high-quality prints. It includes a professional die-line with fold & glue flaps for easy assembly, perfect for branding agencies and designers seeking print-ready solutions.","https://brandex-cdn.b-cdn.net/PACKAGING/Brandex-21-Dec/Brandex Herbal tea Watermelon2/Herbal tea Watermelon.jpg","herbal tea packaging; watermelon graphic; vector die-line; tea box design; print production ready"
"5ca27a32-0fff-49c5-91bb-647e667dcb34","High-Resolution Kraft Coffee Packaging Vector Die-Line","Coffee","Optimize your brand's presence with this high-resolution vector coffee packaging. It includes a detailed die-line for easy production and full customization, perfect for showcasing coffee roasters' and branding agencies' designs. Ensure your product achieves maximum shelf impact in both retail and e-commerce environments.","https://brandex-cdn.b-cdn.net/PACKAGING/Brandex-21-Dec/coffe12/coffe12.jpg","coffee packaging; kraft material; vector die-line; retail packaging; e-commerce packaging"
"2cf562db-a3fc-4296-8f04-7e894f62dee8","Orange Herbal Tea Box Packaging Die-line Template Print-Ready","Tea","This robust die-line template provides a professional structure for herbal tea packaging, specifically tailored for orange-flavored tea products. It features intuitive fold and glue flaps for effortless assembly. Optimized for print production, this template empowers branding agencies and designers to create visually appealing tea boxes with a polished presentation for health-conscious consumers.","https://brandex-cdn.b-cdn.net/PACKAGING/Brandex-21-Dec/Brandex Herbal tea Orange2/Herbal tea Orange.jpg","herbal tea packaging; orange tea box; die-line template; print production ready; custom tea packaging"
"1976fea0-32da-4595-b19e-6e598b339832","Laundry Detergent Box Packaging Design Template Print-Ready Modern","Cleaning & Household","A sleek, modern packaging solution for laundry detergent brands. This template includes a professional die-line, standard box dimensions, and fold-and-glue flaps for easy assembly and seamless print production. Enhance your product's market presence with a sophisticated and visually appealing package, optimized for high-impact branding.","https://brandex-cdn.b-cdn.net/PACKAGING/Brandex-21-Dec/Brandex Laundry Detergent Packaging Design2/Brandex Laundry Detergent Packaging Design2.jpg","Laundry Detergent; Packaging Box; Die-line Template; Print-Ready Packaging; laundry detergent packaging"
"c5da042f-2235-4b6c-a45a-72053b1ed2cf","Eco-Friendly Laundry Detergent Packaging Die-line Template for Print","Cleaning & Household","A comprehensive eco-friendly laundry detergent packaging template including a precise die-line with fold and glue flaps for easy assembly. Designed for retail product presentation, this template is fully print production ready, ensuring a polished and professional look. Perfect for sustainable brands to showcase their cleaning products.","https://brandex-cdn.b-cdn.net/PACKAGING/Brandex-21-Dec/Brandex Laundry Detergent Packaging Design3/Brandex Laundry Detergent Packaging Design3.jpg","laundry detergent packaging; eco-friendly packaging; packaging die-line; print production ready; fold and glue flaps"
"420709ca-1638-4c74-ab98-2db673992e05","Print-Ready Kraft Coffee Bag Packaging Template Retail Die-Line","Coffee","This print-ready coffee bag template features durable kraft material with fold and glue flaps for easy assembly. Ideal for retail coffee brands, it ensures a premium presentation with a standard size die-line optimized for high-quality print production. Enhance your packaging effortlessly.","https://brandex-cdn.b-cdn.net/PACKAGING/Brandex-21-Dec/coffe13/coffe13.jpg","Kraft coffee packaging; Retail coffee bag; Print ready die-line; Coffee packaging template; Fold glue flaps"
"a44e5ebe-063c-4080-a096-26b24303464f","Print-Ready Elegant Tissue Label Packaging Template Custom","Cleaning & Household","Elevate your brand with this sophisticated tissue label template, perfect for luxury product packaging. This print-ready design ensures professional presentation and is fully customizable to align with your unique brand identity, offering precise layout for various product lines and designer needs.","https://brandex-cdn.b-cdn.net/PACKAGING/Brandex-21-Dec/Brandex Tissue Label Design 7/Brandex Tissue Label Design 7.jpg","tissue label; packaging design; luxury packaging; print-ready label; customizable die-line"
"f1c31449-305e-44d0-a5ed-d79ceb122bdf","Eco-Friendly Laundry Detergent Packaging Template Print-Ready Die-Line","Cleaning & Household","Optimize your product presentation with this sustainable laundry detergent packaging. It offers a modern aesthetic for eco-conscious brands, featuring easy customization, an included die-line, and essential fold & glue flaps for seamless, print-ready production. Elevate your brand with a premium, environmentally friendly look suitable for various packaging materials.","https://brandex-cdn.b-cdn.net/PACKAGING/Brandex-21-Dec/Brandex Laundry Detergent Packaging Design4/Brandex Laundry Detergent Packaging Design4.jpg","laundry detergent packaging; eco-friendly packaging; packaging die-line; print production ready; fold and glue flaps"
"31d13058-1c97-4e20-b578-65919c71f4aa","Kraft Paper Coffee Bag Die-line Packaging Template","Coffee","This die-line packaging template provides a sleek coffee bag structure optimized for Kraft paper. Featuring precise fold and glue flaps, this template is ready for professional print production, helping your coffee brand achieve a distinctive shelf presence. Ideal for branding agencies and product designers, it enables easy customization to elegantly showcase unique coffee blends.","https://brandex-cdn.b-cdn.net/PACKAGING/Brandex-21-Dec/coffe17/coffe17.jpg","kraft paper; coffee bag; die-line template; print production; sustainable packaging"
"209cd0e3-1691-4eb0-baa1-e6881b7e1594","Print-Ready Kraft Coffee Bag Die-line Packaging Template","Coffee","This die-line template for a Kraft coffee bag is engineered for optimal packaging, featuring fold and glue flaps. It accommodates standard coffee bag dimensions, ensuring a sleek aesthetic. Ideal for coffee brands to enhance product presentation, this template is print production ready, offering a realistic representation of branding on durable material. Perfect for small and large batch production needs.","https://brandex-cdn.b-cdn.net/PACKAGING/Brandex-21-Dec/coffe15/coffe15.jpg","kraft coffee bag; coffee bag packaging; coffee house; print ready coffee bag; coffee beans"
