"id","name","subcategory","description","imageUrl","keywords"
"65c02879-39c0-4b42-abda-3dcd467905a4","Vibrant Purple Gold Malt Drink Bottle Packaging Non-Alcoholic","Alcoholic Beverages","This vibrant bottle packaging is expertly crafted for non-alcoholic malt beverages, featuring eye-catching purple and elegant gold color accents. Ideal for brands looking to convey a lively and sophisticated image for their drink products. Perfect for showcasing new beverage line packaging.","https://image-brandex.b-cdn.net/images/Malt 2 Drink Bottle Packaging1.jpeg","Malt drink bottle; Purple gold packaging; Non-alcoholic beverage; Vibrant bottle; Beverage packaging"
"30c32aab-29ab-4037-a8d7-959ef22dc2f9","Metallic Non-Alcoholic Pineapple Beverage Bottle Packaging Blue Silver","Alcoholic Beverages","Showcase your pineapple-flavored non-alcoholic beverage with this striking blue and silver metallic bottle packaging. This bold and modern design is crafted to attract consumers seeking refreshing, high-quality drinks, ensuring your product stands out on any shelf.","https://image-brandex.b-cdn.net/images/Malt 4 Pineapple Drink Bottle Packaging 2.jpg","beverage bottle packaging; non-alcoholic drink; pineapple flavor; metallic finish; blue silver packaging"
"71b772a2-8005-4e8a-9486-1f1c5a7cf8e7","Vibrant Metallic Lemon Drink Bottle Packaging Red Blue","Alcoholic Beverages","This striking bottle design features prominent metallic elements and a vibrant red and blue color scheme, perfectly crafted for non-alcoholic lemon beverages. It aims to catch the eye on shelves, enhancing product appeal and brand recognition.","https://image-brandex.b-cdn.net/images/Malt 4 Lemon Drink Bottle Packaging 3.jpg","lemon drink bottle; metallic packaging; beverage bottle; red blue accents; non-alcoholic"
"4fd70b70-ec3b-45e9-b15b-6598205df3a6","Purple Chocolate Ice Cream Bar Packaging Wrapper Bold Green Text","Ice Cream & Frozen Desserts","This vibrant purple packaging wrapper is specifically designed for chocolate ice cream bars. It features eye-catching green text and an appetizing chocolate image, ensuring your frozen dessert stands out. Ideal for food brands seeking a bold and distinctive look for their products.","https://image-brandex.b-cdn.net/images/Magnum Ice Cream Packaging Design35.jpg","ice cream bar; chocolate wrapper; purple food packaging; green text packaging; dessert branding"
"c1ddc266-d569-48eb-a7ba-63aa23e6e630","Vibrant Green White Non-Alcoholic Malt Drink Bottle Label Design","Alcoholic Beverages","Elevate your non-alcoholic malt drink with this vibrant green and white bottle label design. This packaging solution features bold branding elements, ensuring your product stands out on retail shelves. Perfect for beverage companies seeking a modern and eye-catching visual identity that clearly communicates quality and refreshment. Includes editable vector files for seamless customization.","https://image-brandex.b-cdn.net/images/Malt 6 Drink Bottle Packaging.jpg","non-alcoholic beverage; malt drink packaging; green white bottle label; beverage branding kit; product label artwork"
"b882823d-7d3f-4707-be27-171ea2e19fcb","Vibrant Purple Macaron Wrapper Teal Accent Confectionery Packaging","Tea","Elevate your confectionery brand with this vibrant purple macaron wrapper. Designed with elegant teal accents, it perfectly showcases delicate macarons and other sweet treats. Ideal for bakeries, patisseries, and gourmet gift packaging, ensuring a memorable unboxing experience.","https://image-brandex.b-cdn.net/images/Macarone Packaging Design74.jpg","macaron wrapper; vibrant purple; teal accent; confectionery packaging; bakery packaging"
"fa1ae176-f772-4d96-a1ee-3decacfe112a","Vibrant White Mango Juice Carton Packaging Design","Juice & Water","This product showcases a bright white beverage carton, adorned with a vibrant mango illustration and glistening dewdrops, designed to convey a refreshing and appealing product experience. Ideal for branding and marketing healthy fruit drinks.","https://image-brandex.b-cdn.net/images/Juice Drink Packaging Design5.jpg","mango juice carton; beverage packaging; white carton design; refreshing drink packaging; dewdrop fruit packaging"
"0234c720-48a0-4fd4-8d0a-10e3ed7d7248","Vibrant Blue Chocolate Ice Cream Wrapper Packaging Design","Ice Cream & Frozen Desserts","This vibrant and colorful packaging wrapper design, featuring striking blue accents, is specifically created for chocolate ice cream products and other frozen treats. Ideal for brands looking to present their confectionery in an appealing and eye-catching manner on store shelves, enhancing market visibility and consumer attraction.","https://image-brandex.b-cdn.net/images/Magnum Ice Cream Packaging Design18.jpg","ice cream wrapper; chocolate packaging; frozen treat packaging; ice cream packaging; snack container"
"234320d7-ba92-46c7-96ab-8ed40402adb3","Modern Blueberry Juice Carton Packaging Design Blue White","Juice & Water","This vibrant juice carton design showcases fresh blueberries on a crisp white background, ideal for modern beverage branding and food packaging applications. Perfect for product mockups and market visualization.","https://image-brandex.b-cdn.net/images/Juice Drink Packaging Design2.jpg","blueberry juice; carton packaging; beverage packaging; beverage container; juice packaging"
"0d9de148-18e7-41f2-9e63-71b8a82e5dba","Vibrant Peach Beverage Bottle Packaging Design","Alcoholic Beverages","Showcase your non-alcoholic beverage with this vibrant bottle packaging design. Features a bold logo and eye-catching peach imagery, perfect for attracting customers. This design ensures your drink stands out on shelves, making it ideal for marketing new products.","https://image-brandex.b-cdn.net/images/Malt 4 Peach Drink Bottle Packaging 6.jpg","peach beverage bottle; drink bottle packaging; beverage container; bottle; non-alcoholic beverage"
"ff5da5f2-350f-4c0b-b76d-0195badba1fe","Vintage Blue Gold Malt Drink Bottle Packaging Illustration","Alcoholic Beverages","This vibrant packaging concept features a striking blue and gold color palette, perfectly suited for a non-alcoholic malt drink. It includes a detailed vintage illustration for a classic, sophisticated brand identity, ensuring your beverage stands out on shelves.","https://image-brandex.b-cdn.net/images/Malt 3 Pineapple Drink Bottle Packaging 2.jpg","malt drink packaging; vintage bottle illustration; non alcoholic beverage; blue gold branding; drink label"
"9ef31684-b724-4217-ad2e-dd1d8706db21","Blue Realistic Chocolate Ice Cream Bar Packaging Wrapper","Ice Cream & Frozen Desserts","This vibrant blue packaging wrapper features a highly realistic chocolate ice cream illustration, perfect for frozen treat brands looking to attract customers with visually appealing, delicious-looking product designs.","https://image-brandex.b-cdn.net/images/Magnum Ice Cream Packaging Design39.jpg","Chocolate ice cream; Blue packaging wrapper; Frozen treats bar; Realistic food illustration; Ice cream bar packaging"
"bc4ac2d9-38cd-4acc-aaac-0c1907aa3d2d","Vibrant Swirl Laundry Detergent Label Design","Cleaning & Household","Elevate your liquid laundry detergent product with this vibrant label design featuring a dynamic, colorful swirl. This digital packaging mockup is perfect for showcasing a fresh scent appeal and creating a distinctive brand identity that captures consumer attention on shelves.","https://image-brandex.b-cdn.net/images/Laundry Detergent Packaging Design.jpg","laundry detergent label; colorful swirl graphics; product packaging mockup; vibrant brand identity; fresh scent appeal"
"ee7dc435-ec49-4389-b875-f30390c408c1","Mayonnaise Condiment Jar Label Design with Fresh Tomato Herb Imagery","Sauces, Condiments & Spreads","This eye-catching design features a colorful mayonnaise label adorned with vibrant fresh tomatoes and aromatic herb illustrations. Ideal for condiment brands seeking to elevate their product packaging with a marketable, premium aesthetic for jars and bottles.","https://image-brandex.b-cdn.net/images/Mayonnaise.jpg","mayonnaise label; condiment packaging; food jar design; tomato herb illustration; vibrant food branding"
"95f0ced6-89dc-4ea8-af10-d91cdbc07942","Magenta Chocolate Ice Cream Packaging Wrapper Label Design","Ice Cream & Frozen Desserts","This vibrant packaging design features a bold magenta background contrasted with a luscious, mouth-watering chocolate-coated ice cream visual, perfect for enhancing your frozen dessert product's appeal and market presence.","https://image-brandex.b-cdn.net/images/Magnum Ice Cream Packaging Design10.jpg","chocolate ice cream; magenta wrapper; food product label; dessert packaging; luscious chocolate visual"
"709dcfaa-e4a7-4f9f-b4de-35cb9d8447e1","Dynamic Blue Red Chocolate Ice Cream Bar Packaging Design","Ice Cream & Frozen Desserts","Showcase your lively chocolate ice cream bar with this vibrant blue and red packaging solution. Ideal for frozen desserts, it features a dynamic visual design to attract snack enthusiasts.","https://image-brandex.b-cdn.net/images/Magnum Ice Cream Packaging Design22.jpg","chocolate ice cream bar; ice cream packaging; blue red wrapper; vibrant snack label; frozen dessert packaging"
"3d2de239-7f1e-48cc-9eda-bd5c761e7624","Peach Juice Carton Packaging Vibrant Orange Design","Juice & Water","Showcase your brand with this vibrant peach juice carton packaging, featuring a bold orange design and a realistic peach illustration. Ideal for beverage branding and product visualization, ensuring your drink stands out on shelves.","https://image-brandex.b-cdn.net/images/Peach-Juice.jpg","peach juice; juice carton; beverage packaging; orange packaging; fruit drink"
"232b678f-4112-477c-bcd3-bd900fa19d20","Luxury Deep Blue Gold Chocolate Ice Cream Wrapper Packaging","Ice Cream & Frozen Desserts","This sophisticated ice cream wrapper design features a rich, deep blue background accented with luxurious gold foil text, ideal for premium chocolate desserts and gourmet frozen treats. It elevates brand perception for high-end patisseries and specialty food businesses looking to impress discerning customers.","https://image-brandex.b-cdn.net/images/Magnum Ice Cream Packaging Design27.jpg","ice cream packaging; chocolate packaging; luxury food branding; deep blue gold; dessert wrapper"
"a35cc28a-4119-49fc-ae3e-b403a52fc75c","Black Macaron Wrapper Gold Text Confectionery Packaging","Chocolate & Confectionery","This premium black macaron wrapper features elegant cursive gold text and detailed macaron imagery. Perfect for upscale confectionery businesses, bakeries, or personal gifting of gourmet desserts. Designed to enhance the presentation of delicate sweets, making them ideal for special occasions and luxury branding.","https://image-brandex.b-cdn.net/images/Macarone Packaging Design69.jpg","macaron packaging; black wrapper; gold text; confectionery box; dessert gift box"
"dab1d926-cb96-4c3b-81ed-43825b969199","Frozen Lasagna Meal Box Packaging Blue Classic","Pasta, Rice & Grains","Optimize your frozen lasagna meal brand with this vibrant blue box packaging. It showcases a delicious lasagna image and features a classic design style, perfect for attracting customers in the frozen food aisle. Includes high-resolution graphic files ready for print.","https://image-brandex.b-cdn.net/images/Lasagna Packaging Design.jpg","frozen lasagna; food packaging; meal box; blue packaging; classic style"
"b7f14cfb-3fd9-4ee8-a244-193b7effd573","Vibrant Yellow Lemon Candy Sachet Packaging Design","Chocolate & Confectionery","This visually appealing sachet packaging design features a bright yellow color palette, ideal for sugar-free lemon candies. It includes fresh citrus imagery, meticulously crafted to attract health-conscious consumers and highlight the natural flavor profile. Perfect for food brands seeking a vibrant and clear product presentation.","https://image-brandex.b-cdn.net/images/LEMON.jpg","lemon candy packaging; sachet package; sugar-free candy; yellow packaging; citrus imagery"
"1753a666-7467-4cfa-8fdb-34cb1c2b45dd","Rustic Vintage Brown Bottle Packaging for Non-Alcoholic Malt Drinks","Alcoholic Beverages","This eye-catching brown bottle packaging features a distinctive vintage portrait label, perfectly suited for non-alcoholic malt drinks and beverages, ensuring high visual appeal on shelves.","https://image-brandex.b-cdn.net/images/Malt 3 Red Grape Drink Bottle Packaging 5 2.jpg","Malt drink bottle; Brown bottle packaging; bottle; beverage container; malt beverage packaging"
"45b43022-353a-4e1f-87ee-cb1383dbbdd0","Tall Green Kiwi Fruit Juice Carton Packaging Design","Juice & Water","This professional design features a sleek, tall carton specifically crafted for fresh kiwi juice. It showcases vibrant green kiwi fruit visuals, providing an appealing and modern aesthetic for beverage brands. Ideal for enhancing product shelf presence and attracting health-conscious consumers with its clean and refreshing look. Perfect for juice industry marketing.","https://image-brandex.b-cdn.net/images/Kiwi-Juice.jpg","kiwi juice; fruit packaging; tall carton; green packaging; beverage design"
"3a24f183-287e-4610-88dd-01d1eb9f797d","Bold Orange Chocolate Ice Cream Bar Packaging","Ice Cream & Frozen Desserts","This eye-catching orange ice cream bar wrapper features bold white text and realistic chocolate imagery, designed to attract customers. Perfect for frozen dessert product branding and retail display.","https://image-brandex.b-cdn.net/images/Magnum Ice Cream Packaging Design36.jpg","Ice Cream Bar Wrapper; Orange Packaging Design; Chocolate Imagery; Bold White Text; Food Product Sleeve"
"54bcce9a-cc31-4737-9ab2-5621e1e9ea0e","Printable Cigarette Box Packaging Black Red Geometric Accents","Cigarettes, Vape & Gum","Optimize your premium cigarette brand with this customizable packaging. Features a striking black finish with bold red geometric accents, perfect for luxury tobacco products. This printable box layout is ideal for showcasing high-end cigarettes.","https://image-brandex.b-cdn.net/images/Kanxa Cigarettes Inner.jpeg","Cigarette packaging box; Black red accents; Geometric packaging; Luxury tobacco packaging; Printable box layout"
"11afcdf0-29d0-469c-9dca-ebaf78dffed8","Bold Knight Emblem Non-Alcoholic Beverage Bottle Label Blue Red Metallic","Alcoholic Beverages","A vibrant and bold packaging solution designed specifically for non-alcoholic drink bottles. This label features a striking metallic knight emblem, set against a dynamic blue and red color palette, ensuring your product stands out. Perfect for enhancing brand presence with a regal and powerful aesthetic.","https://image-brandex.b-cdn.net/images/Malt 4 Pomegranate Drink Bottle Packaging 4.jpg","non-alcoholic bottle label; bold beverage packaging; drink product label; bottle; beverage container"
"aa19f76f-4cbe-4230-b36e-d23ca0f7f932","Brown White Chocolate Bar Ice Cream Wrapper","Ice Cream & Frozen Desserts","This sleek ice cream wrapper design features a tempting chocolate bar image on a sophisticated brown and white color palette. Perfect for enhancing your dessert branding, this design is ideal for chocolate-flavored ice cream products. It offers a modern and appealing visual for captivating customers.","https://image-brandex.b-cdn.net/images/Magnum Ice Cream Packaging Design19.jpg","chocolate ice cream; ice cream wrapper; brown white aesthetic; chocolate bar graphic; dessert packaging"
"c685ec28-dfa7-42db-ac69-d7a0e3e3b9ff","Bold Pink Yellow Chocolate Ice Cream Bar Wrapper Packaging","Ice Cream & Frozen Desserts","Vibrant pink and yellow wrapper designed for chocolate ice cream bars. Features bold yellow text on a vivid pink background, perfect for attractive product packaging. Ideal for enhancing the visual appeal of frozen treats.","https://image-brandex.b-cdn.net/images/Magnum Ice Cream Packaging Design40.jpg","chocolate ice cream; pink wrapper; ice cream bar; yellow typography; food product wrapper"
"80542da9-f548-458a-b065-c78e4735806b","Brown Macaron Snack Box Packaging Elegant Confectionery","Chocolate & Confectionery","Present your delicate macarons and other sweet treats in this elegant brown snack packaging. Designed specifically for confectionery businesses, it provides a sophisticated and inviting look for delicious baked goods.","https://image-brandex.b-cdn.net/images/Macarone Packaging Design73.jpg","macaron packaging; snack box; brown packaging; confectionery packaging; elegant food packaging"
"3dc147bf-9c76-4607-b538-ffaf21439439","Ice Cream Bar Packaging Wrapper Blue Red Dynamic Graphics","Ice Cream & Frozen Desserts","This eye-catching wrapper is designed specifically for ice cream bars, featuring a dynamic blue and red color scheme with bold, attention-grabbing graphics. Ideal for frozen dessert products, it helps your brand stand out on shelves and attract customers. The design is easily adaptable for various branding needs and product variations.","https://image-brandex.b-cdn.net/images/Magnum Ice Cream Packaging Design23.jpg","ice cream bar; packaging wrapper; blue red; bold graphics; frozen dessert"
"da2029e2-edd5-43e7-8af8-835a2191aab8","Vibrant Blue Chocolate Ice Cream Bar Wrapper Packaging Template","Ice Cream & Frozen Desserts","This eye-catching vibrant blue packaging template is perfect for chocolate ice cream bars. It showcases an appealing image of a frozen chocolate treat, designed to attract customers looking for refreshing desserts and stand out on shelves.","https://image-brandex.b-cdn.net/images/Magnum Ice Cream Packaging Design43.jpg","chocolate ice cream; blue wrapper; ice cream bar; frozen dessert packaging; food product packaging"
"aab9b2bd-96bb-4045-8356-c8af142d2e12","Luxury Red Gold Ice Cream Bar Wrapper Packaging Mockup","Ice Cream & Frozen Desserts","Showcase your premium frozen dessert brand with this elegant red and gold ice cream bar wrapper. Features a tempting chocolate visual, perfect for high-end ice cream packaging presentations and branding projects.","https://image-brandex.b-cdn.net/images/Magnum Ice Cream Packaging Design3.jpg","ice cream bar; chocolate visual; luxury packaging; red gold wrapper; packaging mockup"
"d13590ff-09b5-42e7-8a16-a06576a9b715","Purple Indulgent Chocolate Bar Packaging Wrapper","Chocolate & Confectionery","Showcase your premium chocolate bars with this opulent purple wrapper. Features rich chocolate imagery, perfect for creating an indulgent and vibrant brand experience for consumers. This design ensures your confectionery stands out with sophisticated presentation.","https://image-brandex.b-cdn.net/images/Magnum Ice Cream Packaging Design11.jpg","chocolate bar wrapper; purple packaging; indulgent food; confectionery branding; luxury chocolate"
"2fe28578-14bc-4f7d-b8f4-cf1f039f98e3","Green Gold Luxury Chocolate Ice Cream Bar Wrapper","Ice Cream & Frozen Desserts","Elevate your brand with this elegant wrapper designed for premium chocolate ice cream bars. Features a luxurious green base complemented by sophisticated gold accents. Perfect for high-end dessert brands seeking an exclusive look.","https://image-brandex.b-cdn.net/images/Magnum Ice Cream Packaging Design9.jpg","chocolate ice cream; ice cream wrapper; luxury packaging; green gold; bar packaging"
"573a15cb-93f0-48c8-8db7-5275603d98d0","Blue Macaron Dessert Food Packaging Wrapper Design Template","Chocolate & Confectionery","Enhance your dessert brand with this vibrant blue macaron wrapper design, perfect for confectionery, bakery treats, and other sweet delights. This template features colorful macaron illustrations to attract customers and present your sweet products beautifully. Ideal for cafes, patisseries, and home bakers.","https://image-brandex.b-cdn.net/images/Macarone Packaging Design75.jpg","macaron packaging; blue wrapper; dessert food; confectionery design; bakery packaging"
"8af86388-217e-45e1-86c0-571c49d25a8f","Black Cigarette Box Packaging Futuristic Neon Purple Blue Accents","Cigarettes, Vape & Gum","This futuristic cigarette box packaging features a sleek black base complemented by vibrant neon purple and striking blue accents, ideal for modern product branding and unique presentations requiring a distinct visual impact.","https://image-brandex.b-cdn.net/images/MOTAX Cigarettes Inner Mockup 2.jpeg","cigarette box packaging; futuristic style; black and neon; purple accents; blue highlight details"
"fae44d35-d1ee-4fdd-893e-a75460a1cc16","Playful Pineapple Fruit Sparkling Beverage Can Packaging","Energy & Soft Drinks","Elevate your sparkling fruit beverage brand with this vibrant, playful can packaging. Features a charming cartoon pineapple illustration, perfect for attracting consumers to fun, fruity drinks. This versatile design can be adapted for various fruit flavors and print production.","https://image-brandex.b-cdn.net/images/Fresh Juice 330ml Packaging Design3.jpg","pineapple beverage can; sparkling fruit drink; playful can art; tropical drink label; fruit can wrap"
"d469ce71-0573-4090-9e0f-41e0d473a5de","Dessert Packaging Box Cream Caramel Vibrant Blue Elegant","Chocolate & Confectionery","Showcase delectable cream caramel desserts with this vibrant blue packaging box, designed to convey elegance. Features include eye-catching blue tones and sophisticated white typography for an appealing presentation.","https://image-brandex.b-cdn.net/images/Cream-Caramel.jpg","cream caramel; dessert box; vibrant blue; elegant typography; food packaging"
"aaca3f68-f095-4c53-b87b-0fca7b92c21a","Playful Kiwi Illustration Sparkling Drink Can Packaging","Energy & Soft Drinks","Discover this captivating and quirky packaging design for sparkling beverages, featuring a vibrant, hand-drawn kiwi illustration. Perfect for brands seeking a playful and eye-catching aesthetic to stand out on shelves and attract a youthful audience. This design offers a fresh, unique look for your drink products.","https://image-brandex.b-cdn.net/images/Fresh Juice 330ml Packaging Design 22.jpg | https://image-brandex.b-cdn.net/images/Fresh Juice 330ml Packaging Design2.jpg","kiwi fruit illustration; sparkling beverage; drink can packaging; playful art style; product branding"
"6f2ae23e-9daa-4c4e-96f5-56659b8b62f2","Playful Sketch Black Grape Sparkling Beverage Can Packaging","Energy & Soft Drinks","This vibrant packaging features a unique sketch-style black grape character, perfect for sparkling beverage brands seeking a playful and eye-catching design. Ideal for soda, juice, or sparkling water products looking to stand out on shelves with a distinctive and memorable visual identity.","https://image-brandex.b-cdn.net/images/Fresh Juice 330ml Packaging Design 21.jpg","black grape; sparkling beverage; can packaging; sketch illustration; playful character"
"1f503e4c-70a1-4cf7-a505-a7bcde2601b1","Sparkling Beverage Can Packaging Tribal Pineapple Cartoon","Energy & Soft Drinks","This vibrant packaging design is ideal for sparkling beverage brands seeking a playful and eye-catching aesthetic. It features a unique cartoon pineapple illustration set against a dynamic tribal pattern, perfect for products aimed at a fun-loving audience seeking a distinctive visual identity.","https://image-brandex.b-cdn.net/images/Fresh Juice 330ml Packaging Design 33.jpg","can packaging; sparkling beverage; tribal pattern; beverage container; can"
"b3fb6b9d-d4ee-4674-a7b3-d85339e21f93","Chocolate Croissant Food Packaging Pouch Brown Cream","Chocolate & Confectionery","This elegant brown and cream pouch packaging features a mouth-watering chocolate-filled croissant graphic, perfect for bakeries, cafes, and artisanal snack producers looking to attract customers. Ideal for various bakery products, ensuring freshness and appealing presentation.","https://image-brandex.b-cdn.net/images/Croissant.jpg","chocolate croissant; bakery pouch; food packaging; brown cream colors; snack bag"
"47771490-c22d-4e2c-80db-8822160cd3fa","Green Crispy Sweet Biscuit Packaging Box Intricate Pattern","Chocolate & Confectionery","Discover our vibrant green packaging box, meticulously crafted with intricate biscuit patterns. This design is perfect for confectionery brands seeking an appealing and distinctive presentation for their crispy and delicious sweet biscuits. Ideal for enhancing product visibility and consumer appeal.","https://image-brandex.b-cdn.net/images/Crispy-Salty-Biscuits-11.jpg","biscuit packaging; green box; crispy biscuits; sweet treats; intricate pattern"
"1c1481d2-519c-4dd1-b316-6aa3a808058d","Vibrant Yellow Pink Chocolate Strawberry Sandwich Cookies Packaging Box","Chocolate & Confectionery","This product features a bright yellow packaging box design with bold pink typography and mouth-watering images of chocolate biscuits filled with strawberry cream. Ideal for food brands seeking vibrant and eye-catching product presentation for their delicious sandwich cookies.","https://image-brandex.b-cdn.net/images/Crispy-Chocolate-Biscuits-Filled-With--Strawberry-Cream.jpg","sandwich cookies; chocolate strawberry; packaging box; yellow pink; food packaging"
"9e71b87a-9c5a-447c-af67-8e0440b0d40c","Vibrant Green Blue Chicken Fillet Tray Packaging Template","Meat & Poultry","Showcase fresh chicken fillets with this vibrant green and blue tray packaging design. This versatile layout is perfect for brands seeking eye-catching, high-quality food presentation. Includes editable files for easy customization.","https://image-brandex.b-cdn.net/images/FILLET Chicken Label Tray Design 2.jpeg","Chicken Fillet Packaging; Food Tray Design; Vibrant Branding; Green Blue Label; Meat Product Container"
