"id","name","subcategory","description","imageUrl","keywords"
"b75227fc-5353-461a-938a-e7e7d409315f","Fast-Absorbing Paracetamol Blister Packaging Blue Purple Vibrant","Pharmaceutical & Health","This vibrant blue and purple blister packaging design is tailored for fast-absorbing paracetamol tablets. It features a modern, dynamic layout suitable for pharmaceutical products, ensuring clear branding and dosage information visibility. Ideal for over-the-counter pain relief medication brands seeking impactful shelf presence and consumer appeal.","https://image-brandex.b-cdn.net/images/Brandex Drugs Label Design 1104 copy.jpg","paracetamol packaging; blister pack design; pain relief medication; oral tablet packaging; medicine packaging"
"e5d9ab23-4426-4e6f-a4c6-e23685fd21b7","Black Cylinder Packaging for Gourmet Vanilla Biscuit Snacks","Biscuits, Cookies & Wafers","This sleek black cylindrical packaging is ideal for gourmet biscuit brands. It features realistic vanilla cream biscuit imagery, perfect for enhancing product appeal and marketability for premium snack products.","https://image-brandex.b-cdn.net/images/Biscuits-with-Vanilla-10.jpg | https://image-brandex.b-cdn.net/images/Biscuits-with-Vanilla-7.jpg","black packaging; biscuit tube; gourmet snacks; vanilla cream; cylindrical container"
"21473e98-f978-4aa1-a340-5e95a0c8ddab","Red Coconut Chocolate Bar Packaging with Bold White Text","Chocolate & Confectionery","This eye-catching red wrapper is designed specifically for coconut-flavored chocolate bars. It features prominent bold white text that stands out, making your product highly visible on shelves. Perfect for confectionery brands seeking a vibrant and modern look.","https://image-brandex.b-cdn.net/images/Cocolate Wafer Packaging Design 6.jpg","red chocolate bar; coconut chocolate; packaging wrapper; candy bar packaging; snack container"
"d13c2cc5-483c-4690-8ef3-7fc47304393d","Whimsical Yellow Banana Flavored Milk Can Packaging Design","Dairy & Milk","Showcase your banana-flavored milk with this bright yellow, whimsical can packaging design. Features playful banana graphics, perfect for attracting young consumers and making your dairy beverage stand out on shelves.","https://image-brandex.b-cdn.net/images/Brandex-BANANA-Milk-250ml-2.jpg","banana milk can; yellow beverage packaging; playful food branding; fruit drink label; dairy product packaging"
"2e649ff2-7694-4636-8b31-db71eb871621","Pink Mojito Fizzy Drink Bottle Packaging with Green Purple Accents","Energy & Soft Drinks","Captivating bottle packaging solution designed for mojito and other fizzy drinks. Features a vibrant pink base with striking bold green and purple accent details. Perfect for beverage brands looking to create an eye-catching and memorable product presence on shelves and in marketing materials. This unique design enhances visual appeal and brand recognition for your refreshing drink line.","https://image-brandex.b-cdn.net/images/Brandex Fizzy Drink Packaging 6.jpg","Mojito bottle; Fizzy drink packaging; Pink drink bottle; Green purple accents; Beverage product label"
"c8c272ef-d00e-45a1-9708-0c141cfd9e52","Vibrant Red Orange Artisanal Dark Chocolate Bar Packaging Illustration","Chocolate & Confectionery","This vibrant and artistic chocolate bar packaging features bold red and orange illustrations, perfect for artisanal dark chocolate brands. The eye-catching design captures a unique, handcrafted feel, ideal for standing out on shelves and appealing to discerning customers.","https://image-brandex.b-cdn.net/images/Brandex Chocolate Bar Mockup 2 5.jpg","chocolate bar packaging; red orange illustration; vibrant artistic; artisanal dark chocolate; candy bar wrapper"
"eec28abc-199f-4b48-a4e1-87861cbb8918","Vibrant Fruit Pattern Black Tea Box Packaging Design","Tea","This vibrant packaging design features an eye-catching fruit and foliage pattern, perfect for black tea boxes. Its lively aesthetic is ideal for brands seeking to captivate customers with a fresh, colorful product presentation.","https://image-brandex.b-cdn.net/images/Brandex Black Tea 1.jpg","tea box packaging; vibrant fruit pattern; food product packaging; colorful beverage box; fruit and foliage"
"83a8707e-7001-42c5-ab5b-fe695d605c84","Chocolate Milk Beverage Can Packaging Design Brown Sleek","Chocolate & Confectionery","A modern, sleek brown can packaging design featuring rich chocolate imagery, specifically crafted for enriched chocolate milk products. This visually appealing container solution aims to enhance brand identity and shelf presence.","https://image-brandex.b-cdn.net/images/Brandex-CHOCOCLATE-Milk-250ml-3.jpg","chocolate milk can; brown beverage packaging; sleek drink container; milk product branding; enriched milk packaging"
"3e25f8be-fa80-42fa-b451-a310e71664d5","Vibrant Yellow Arc Apricot Juice Box Packaging Design","Juice & Water","Showcase fresh beverages with this vibrant apricot juice box design. Features a bold yellow arc and a juicy apricot image, perfect for capturing attention and promoting healthy fruit drinks.","https://image-brandex.b-cdn.net/images/Apricot-Juice.jpg","apricot juice box; yellow arc graphic; beverage carton; fruit drink packaging; vibrant food illustration"
"f27eabc5-c37b-4ff8-8429-cf082cfa466d","Playful Green Lemon Soda Can Packaging Design","Energy & Soft Drinks","Elevate your beverage brand with this vibrant and playful green lemon soda can packaging design. Features include eye-catching lemon graphics and a refreshing color palette, perfect for juice, soda, or sparkling water products. This unique design ensures your drink stands out on shelves and attracts consumers seeking a lighthearted and zesty experience.","https://image-brandex.b-cdn.net/images/Brandex Lemon 250ml.jpg","lemon soda; can packaging; green color scheme; playful illustration; beverage label"
"ed564264-3e52-43cf-84ee-2033ba58d2dc","Gourmet Biscuit Container Packaging Minimalist Gold Foil","Biscuits, Cookies & Wafers","Elevate your brand with this minimalist biscuit container packaging featuring elegant gold foil accents. Perfect for gourmet cookies, crackers, or artisanal treats, designed to convey luxury and quality, attracting discerning customers.","https://image-brandex.b-cdn.net/images/Biscuits-with-Vanilla-4.jpg","biscuit packaging; food container; luxury treats; gold foil; snack box"
"266edcc5-d3b9-4d61-aea1-a15b3e41bdfa","Vibrant Red Blue Splash Cola Can Packaging","Energy & Soft Drinks","Showcasing a dynamic cola can packaging concept, this design features an eye-catching interplay of bold red and blue hues. The dramatic splashes create a sense of energy and movement, set against a sleek, dark background, perfect for modern beverage branding.","https://image-brandex.b-cdn.net/images/Brandex-Carbonated-Drink-Cola.jpg","cola can design; red blue splash; beverage packaging; vibrant drink label; aluminum can artwork"
"3ebe205f-d1d0-47cb-aa72-5cad26b2ff80","Vibrant Kiwi Juice Carton Packaging Bold Red Text Half Fruit","Juice & Water","This eye-catching carton packaging is specifically designed for kiwi fruit juice beverages, featuring a vibrant aesthetic with a prominent half-kiwi graphic. The bold red text highlights the fresh quality of the juice, making it highly appealing on shelves. Ideal for food and beverage brands aiming for a distinctive and refreshing product presentation.","https://image-brandex.b-cdn.net/images/Juice Drink Packaging Design4.jpg","kiwi fruit juice; beverage carton; red text branding; vibrant drink packaging; fruit drink box"
"be5e9ae7-7f09-4bd1-a7a0-9860df388f43","Black Bird Seed Grain Blend Packaging Bag with White Swan Motif","Pet & Bird Food","This elegant black packaging bag features a distinct white swan motif, ideal for premium bird seed blends and grain products. Designed to enhance brand appeal, it offers a sophisticated look for pet food and agricultural packaging needs.","https://image-brandex.b-cdn.net/images/Birds Food Packaging 5.jpg","black packaging bag; white swan motif; bird seed bag; grain blend pouch; pet food packaging"
"ac53fa53-a7a3-4eab-8a28-497f05dfc6f4","Bold Orange Juice Carton Packaging Mockup","Juice & Water","Showcase your fresh fruit juice brand with this vibrant orange carton packaging design. Features bold, legible typography for a modern and appealing beverage presentation. Perfect for product mockups and marketing materials.","https://image-brandex.b-cdn.net/images/Brandex Orange Fresh Juice Packaging.jpg","orange juice; carton packaging; beverage packaging; bold typography; fresh juice"
"412be760-0be3-41e1-abfb-efd06a6e98b6","Purple Abstract Pattern Shampoo Bottle Packaging Mockup","Cosmetics & Personal Care","Present your hair care brand with this sleek purple shampoo bottle packaging design featuring bold white curved abstract patterns. Ideal for showcasing modern cosmetic product mockups and enhancing brand identity in the beauty industry with a distinctive visual style.","https://image-brandex.b-cdn.net/images/Brandex Shampoo Mockup 1.jpg","shampoo bottle; purple abstract pattern; hair care packaging; cosmetic bottle mockup; beauty product branding"
"4c41e889-69a5-4de8-a202-c3981d98834c","Luxury Lotion Pump Bottle Packaging Design Floral Grayscale","Cosmetics & Personal Care","This elegant packaging concept presents a stylish pump bottle adorned with intricate floral patterns rendered in a sophisticated grayscale palette. Ideal for showcasing luxury lotions, serums, or creams, it ensures high discoverability for premium cosmetic brands. Includes adaptable files for branding customization.","https://image-brandex.b-cdn.net/images/Air Freshener Packaging Design 2.jpg","floral grayscale; pump bottle; luxury lotion; cosmetic packaging; dispenser bottle"
"14ce1237-43fd-4e2c-91b3-9e70b4c2de5d","Coffee Cup Packaging Design with Cartoon Bean","Coffee","This playful coffee cup packaging features a delightful cartoon bean graphic on a clean minimalist white background. Perfect for cafes and beverage brands seeking a charming and modern brand identity.","https://image-brandex.b-cdn.net/images/COFFEE CUP 8.jpeg | https://image-brandex.b-cdn.net/images/COFFEE CUP 5.jpeg | https://image-brandex.b-cdn.net/images/COFFEE CUP 9.jpeg","coffee cup packaging; beverage packaging; beverage container; cup; coffee house branding"
"7b195feb-b456-41e7-8a35-682e283e161c","Red Mac and Cheese Instant Meal Box Packaging Design","Dairy & Milk","This vibrant red packaging design features a delicious creamy mac and cheese image, perfectly suited for instant, ready-to-eat meal products. Ideal for brands seeking eye-catching shelf presence and quick consumer recognition in the ready-meal category.","https://image-brandex.b-cdn.net/images/Brandex-Mac-&-Cheese-Packaging-Design-4.jpg","mac and cheese box; instant meal packaging; red food packaging; ready meal container; food product box"
"9c322e7b-2725-45c4-a0d3-aa0fcad24690","Elegant Hand-Drawn Coffee Cup Packaging for Premium Cold Brew","Coffee","Enhance your premium cold brew or other high-end beverages with this elegant, hand-drawn coffee cup packaging. The sleek illustrated style creates a sophisticated visual identity, perfect for elevating your brand's presence and attracting discerning customers in the competitive beverage market.","https://image-brandex.b-cdn.net/images/COFFEE CUP 4.jpeg","coffee cup packaging; hand drawn illustration; cold brew packaging; beverage container; illustrated drink packaging"
"da54164f-dded-408f-8ea4-a41a12ee65c8","Bold Red Mac and Cheese Product Packaging Design Carton","Pasta, Rice & Grains","This vibrant mac and cheese product packaging design features bold red tones and appetizing creamy pasta imagery, perfect for quick meal brands. It emphasizes convenience and visual appeal to capture consumer attention on store shelves.","https://image-brandex.b-cdn.net/images/Brandex-Mac-&-Cheese-Packaging-Design-5.jpg","mac and cheese packaging; red food carton; quick meal branding; pasta product box; vibrant grocery packaging"
"54f59c33-81f3-4ee1-b41c-4e222980e97a","Dark Blue Coffee Pouch Packaging Steaming Cup Illustration Premium Beans","Coffee","Showcase your premium coffee beans with this sophisticated dark blue coffee pouch. It features an elegant steaming cup illustration, perfect for conveying warmth and quality to your customers. Ideal for high-end roasted coffee products.","https://image-brandex.b-cdn.net/images/Brandex-Coffee-Packaging-3.jpg","coffee pouch; dark blue; steaming cup; product packaging; premium coffee beans"
"678ddbd4-4c3e-427f-89a9-755d8e21552f","Kids Fruit Cereal Box Packaging with Playful Lion Mascot","Breakfast Cereal","A vibrant and cheerful cereal box packaging design, perfect for attracting young consumers to fruit-flavored cereals. This playful design features an eye-catching lion mascot that appeals directly to kids, making breakfast exciting. Ideal for brands targeting children's food products with a fun and fruity aesthetic.","https://image-brandex.b-cdn.net/images/Cereal Packaging Design4.jpg","cereal box; kids packaging; fruit cereal; lion mascot; food packaging"
"ea4e04ca-f4eb-4285-be7d-f53ebee0506f","Luxury Coffee Packaging Bag Gold Foil Steaming Design","Coffee","This elegant coffee packaging bag features a stunning gold cup motif with a steaming hot coffee graphic, perfect for showcasing premium roasted blends. Designed to convey luxury and quality, it enhances brand perception for gourmet coffee products.","https://image-brandex.b-cdn.net/images/Brandex-Coffee-Packaging-5.jpg","coffee packaging; gold foil bag; steaming coffee cup; premium roasted blend; luxury coffee bag"
"1ef640ba-f055-4ff1-aac9-5bc4e3c600e6","Vibrant Citrus Grapefruit Lemonade Can Packaging","Juice & Water","This eye-catching can packaging features vibrant grapefruit and lemon visuals, perfectly crafted for a refreshing lemonade beverage. Ideal for product mockups and brand presentation, offering a bold and zesty aesthetic for beverage branding projects.","https://image-brandex.b-cdn.net/images/Brandex-grapefruit-&-lemon-Natural-Drink-Cans-1-2.jpg","lemonade can; citrus grapefruit; vibrant beverage; beverage container; can"
"2f65185e-5d0c-4470-a350-9dfb3828e3f0","Kids Cereal Box Packaging Vibrant Cartoon Rabbit Mascot","Breakfast Cereal","Captivating packaging for children's cereal and breakfast products, featuring a cheerful cartoon rabbit mascot and a colorful cereal bowl. This vibrant design is perfect for appealing to young consumers and enhancing brand visibility on shelves.","https://image-brandex.b-cdn.net/images/Cereal Packaging Design2.jpg","cereal box packaging; cartoon rabbit mascot; kids food packaging; vibrant illustration; food branding"
"ab830a89-5647-45c9-b183-cd7175674450","Green Cardamom Honey Evaporated Milk Box Packaging Layout","Sauces, Condiments & Spreads","This elegant green packaging layout is specifically designed for evaporated milk products infused with green cardamom and honey flavors. It features a clean, sophisticated aesthetic, ideal for food and beverage brands seeking a distinctive look. The design can be adapted for various milk carton or bottle label formats, providing a professional presentation for your dairy product line.","https://image-brandex.b-cdn.net/images/Cardamom-Milk.jpg","green cardamom; evaporated milk; honey flavor; box packaging; beverage product"
"cf2148f7-d32c-4cf2-a719-19c9389831cf","Vibrant Artistic Coffee Cup Packaging with Colorful Patterns for Cold Brew","Coffee","Elevate your cold brew coffee brand with this vibrant artistic coffee cup packaging. Featuring vivid and colorful patterns, this design is perfect for adding a unique visual appeal to your beverage products, ensuring they stand out on the shelves and attract discerning customers.","https://image-brandex.b-cdn.net/images/COFFEE CUP 14.jpeg","coffee cup packaging; cold brew coffee; vibrant patterns; artistic illustration; beverage packaging"
"4d21b6c1-74bd-4b40-b3f5-2ae23cbf0e98","Circular Organic Cheese Wheel Packaging Blue Illustration","Dairy & Milk","High-quality circular packaging solution for organic cheese wheels, featuring distinctive blue food illustrations. Perfect for brands seeking visually appealing and eco-friendly dairy product presentation.","https://image-brandex.b-cdn.net/images/Cheese-3.jpg","organic cheese packaging; cheese wheel wrapper; blue food illustration; circular packaging label; dairy product packaging"
"5cd404aa-ec11-4f6e-83e9-59259c7e50af","Vibrant Cheddar Cheese Pouch Packaging with Vivid Sky Graphic","Dairy & Milk","Optimize your dairy product marketing with this vibrant cheddar cheese pouch packaging design. Features a dynamic illustration of cheese against a vivid blue sky, perfect for attracting customers in the snack or grocery aisle. Ideal for showcasing premium cheddar products effectively.","https://image-brandex.b-cdn.net/images/Cheese-Label-8.jpg","cheddar cheese pouch; food packaging graphic; vivid cheese illustration; blue sky background; dairy product pouch"
"57a75e03-6f03-4436-b548-fea42d8d6d82","Vibrant Grape Juice Carton Packaging Mockup with Juicy Imagery","Juice & Water","Showcase your delicious fruit drink brand with this vibrant grape juice carton packaging mockup. Featuring realistic juicy grape imagery, this high-resolution asset is perfect for branding projects, marketing materials, and product presentations. Easily customize to fit your beverage line.","https://image-brandex.b-cdn.net/images/Juice Drink Packaging Design 23.jpg","grape juice packaging; beverage carton mockup; fruit drink design; vibrant food branding; juice box illustration"
"83f186a8-ee69-4e23-88e5-13d5e7f205b7","Vibrant Pink Strawberry Milk Beverage Can Packaging Design","Dairy & Milk","This vibrant pink can packaging design features appetizing juicy strawberries, perfect for modern strawberry-flavored milk brands. Ideal for drink products, it enhances shelf appeal and consumer engagement with its striking visual elements.","https://image-brandex.b-cdn.net/images/Brandex-STRAWBERRY-Milk-250ml.jpg","strawberry milk; drink can; pink can; beverage label; fruit packaging"
"0d94a845-0064-4ee7-9f52-ac326511d4d3","Colorful Vegetable Soup Packet Packaging Artwork for Healthy Food Brands","Soup","This vibrant packaging artwork features a colorful illustration of a delicious vegetable soup packet, complete with a spoon and an array of fresh, wholesome vegetables. Ideal for food brands, meal kit services, or healthy product lines seeking an eye-catching and appealing visual identity. The bold color palette ensures maximum shelf appeal and consumer engagement for your product.","https://image-brandex.b-cdn.net/images/Brandex-Soup-Packaging-8.jpg","vegetable soup packaging; food product label; vibrant kitchen graphics; healthy eating brand; food"
"41b4d186-2e4b-4cbf-8ff0-3aa69a22af00","Vibrant Cheddar Cheese Packaging Design Rural Landscape Typography","Dairy & Milk","Engaging and vibrant packaging design for cheddar cheese, featuring a picturesque rural landscape backdrop and bold, dynamic typography. This design is perfect for dairy brands seeking a distinctive and eye-catching presentation for their gourmet cheese products.","https://image-brandex.b-cdn.net/images/Cheese-Label.jpg","Cheddar Cheese; Rural Landscape; Dynamic Typography; Vibrant Food Packaging; Dairy Product Label"
"9c5ff54f-2ae6-4632-bb77-8462a7326ca3","Elegant Black Tea Packaging Box Design Gold Foil Leaf Pattern","Tea","This sleek tea box packaging features an elegant black leaf pattern complemented by luxurious gold foil branding, ideal for premium black tea products. Perfect for showcasing brand sophistication and attracting discerning customers.","https://image-brandex.b-cdn.net/images/Tea Packaging Design 5.jpg","Black tea box; Gold foil accents; Black leaf pattern; Tea brand identity; Beverage packaging"
"3696bfae-1dce-4088-a510-ec38f13b2551","Orange Juice Carton Packaging Graphic Template Realistic","Juice & Water","Showcase your brand with this vibrant orange juice carton packaging graphic template. Features a sleek design with bold orange graphics and a refreshing orange slice illustration, perfect for beverage companies and food product branding. Ideal for presenting fresh drink products.","https://image-brandex.b-cdn.net/images/Orange-Juice.jpg","juice carton mockups; orange beverage packaging; drink box template; fruit juice branding; fresh liquid packaging"
"077f5683-9161-4cf3-a1b6-cfd2f99f46aa","Vibrant Coffee Pouch Packaging for Specialty Roasts","Coffee","Showcase your premium coffee roasts with this vibrant coffee pouch packaging, featuring bold branding elements and detailed espresso bean imagery. Perfect for specialty coffee brands aiming for eye-catching shelf appeal and a luxurious presentation.","https://image-brandex.b-cdn.net/images/Coffee Packaging Design.jpg | https://image-brandex.b-cdn.net/images/Coffee Packaging Design 18.jpg","coffee packaging; espresso beans; coffee pouch packaging; specialty coffee; coffee house"
"45241064-4c28-4e39-b91f-f57025484926","Luxury Black & Gold Pasta Pouch – Farfalle Packaging Design Mockup","Pasta, Rice & Grains","A sophisticated, high-end packaging design for ""Makadon"" pasta. This asset features a sleek matte black stand-up pouch with elegant gold typography and a vibrant Farfalle (bowtie) pasta visual. Included are both the flat label design and a 3D rendered mockup, perfect for luxury food branding, grocery packaging portfolios, or high-end retail marketing.","https://image-brandex.b-cdn.net/images/Pasta Packaging Design 2.jpg","Premium Pasta Mockup; Black Gold Food Packaging; Farfalle Pouch Design; Gourmet Italian Branding; food packaging"
"4eed0d6f-bed8-4ced-a120-9e0074936573","Kids Playful Cereal Box Packaging Cartoon Rabbit Illustration","Breakfast Cereal","Engaging and vibrant cereal box packaging designed specifically for children. Features a cheerful cartoon rabbit illustration and bright, appealing colors to attract young consumers. Ideal for breakfast brands targeting a playful and family-friendly aesthetic. Perfect for standing out on store shelves and delighting kids.","https://image-brandex.b-cdn.net/images/Cereal Packaging Design7.jpg","kids cereal box; cartoon rabbit illustration; playful food packaging; breakfast product packaging; child-friendly packaging"
"abbc4155-b810-4ad9-8ca4-3a5a096a4c66","Vibrant Green Floral Pump Dispenser Bottle for Cosmetic Liquids","Cosmetics & Personal Care","Ideal for lotions, serums, and other cosmetic liquids. This durable pump dispenser features beautiful floral accents on a vibrant green bottle, perfect for enhancing brand aesthetics and user experience. Designed for easy product dispensing.","https://image-brandex.b-cdn.net/images/Air Freshener Packaging Design 4.jpg","green pump bottle; floral packaging; liquid dispenser; cosmetic bottle; vibrant green"
"c0c7d173-e09c-4f70-9239-fc0e360a86ef","Peach Elegant Shampoo Bottle 3D Packaging Mockup","Cosmetics & Personal Care","Present your hair care line with this elegant 3D shampoo bottle mockup. Featuring a soft peach color and a stylish hair illustration, it's perfect for showcasing beauty products, cosmetic branding, and product display for various hair care solutions.","https://image-brandex.b-cdn.net/images/Brandex Shampoo Mockup 3.jpg","shampoo bottle mockup; peach cosmetic packaging; beauty product display; hair care branding; elegant product presentation"
"21ad3415-183e-4e19-a7a5-decc84edd59b","Vibrant Blue Pharmaceutical Pain Relief Tablet Box Packaging with Dynamic Swirls","Pharmaceutical & Health","This vibrant blue pharmaceutical box packaging features dynamic swirls, ideal for pain relief tablets and other medicinal products. It ensures high brand visibility and patient recognition with its distinctive design elements.","https://image-brandex.b-cdn.net/images/Brandex Drugs Label Design 1104.jpg","pharmaceutical box; pain relief; dynamic swirls; medicine packaging; drug lab"
"8d65d1c7-6f47-4351-9a09-866a6f6c5760","Vibrant Orange Floral Pump Bottle Beverage Packaging","Juice & Water","Showcase your beverage products with this vibrant orange pump bottle packaging. Featuring elegant floral motifs, it's perfect for a wide range of drinks, ensuring easy dispensing and an attractive presentation for your brand. Ideal for juices, infused waters, or custom liquid products.","https://image-brandex.b-cdn.net/images/Air Freshener Packaging Design 5.jpg","orange pump bottle; floral beverage packaging; liquid drink container; pump dispenser; floral pattern"
"f9636e77-46b8-4853-b3fb-a2ef36924064","Blue Shampoo Bottle Packaging with Black Silhouette Design","Cosmetics & Personal Care","This visually striking shampoo bottle packaging design features an elegant blue base complemented by a distinct black silhouette, perfect for upscale hair care brands seeking a sophisticated product presentation. Ideal for mockups and product showcases.","https://image-brandex.b-cdn.net/images/Brandex Shampoo Mockup 4.jpg","shampoo bottle; packaging design; blue bottle; black silhouette; hair care product"
"9a5dcb81-00e0-4de3-8109-89aa53cfea3d","Vibrant Green Yellow Pain Relief Tablet Packaging Box","Pharmaceutical & Health","Optimized packaging design for pain relief medication, featuring a bright green and yellow color palette with bold, easy-to-read text on the tablet box. Ensures high visibility and clear product identification for consumers.","https://image-brandex.b-cdn.net/images/Brandex Drugs Label Design 1102.jpg","pain relief medication; tablet packaging box; vibrant green; bold yellow; medicine container"
