"id","name","subcategory","description","imageUrl","keywords"
"c3a7c601-9305-4426-b443-1382e84d83d0","Black Mint Sports Water Bottle Label Template","Sports & Protein Drinks","This sleek black and mint label template is perfect for sports water, energy drinks, or fitness beverages. It is designed to fit clear bottles, providing a modern and bold look for your product. Easily customizable to align with your brand identity.","https://image-brandex.b-cdn.net/images/Multivitamin Drink Bottle greensky 5.jpg","sports water bottle; black mint label; beverage packaging; fitness drink; bottle branding"
"940c2071-b58e-4503-80ea-724bb342ab56","Bright Breakfast Cereal Box Packaging Banana Rice","Pasta, Rice & Grains","This vibrant cereal box packaging features an eye-catching design perfect for breakfast food brands. It highlights banana and rice ingredients prominently, aiming to attract consumers looking for healthy and delicious morning meals. Ideal for product launch or redesign.","https://image-brandex.b-cdn.net/images/Rice Cereal Packaging 2.jpg","Banana Cereal; Rice Cereal; Breakfast Cereal Box; Bright Food Packaging; Food Product Carton"
"855459eb-0276-457b-b788-1a7e4bd1c8e5","Vibrant Cow Print Milk Carton Packaging Template","Dairy & Milk","Download this editable milk carton packaging template featuring a vibrant, playful cow print pattern. Ideal for dairy products, food branding, or beverage packaging. Easily customize colors and elements to suit your product line.","https://image-brandex.b-cdn.net/images/Milk Packaging Design 2.jpg","milk carton packaging; cow print pattern; dairy product branding; food packaging design; beverage carton template"
"f8239f21-1e16-4d71-a8e4-6ae5454a866e","Purple Blue Quick-Dry Indoor Emulsion Paint Can Packaging Design","Paint & DIY","This vibrant packaging design showcases a bold blend of purple and blue hues, specifically tailored for quick-dry indoor emulsion paint products. It ensures high visual appeal and immediate brand recognition on shelves, perfect for differentiating your paint line and attracting customers.","https://image-brandex.b-cdn.net/images/Paint-Can-8.jpg","Purple paint can; Blue paint can; Emulsion paint packaging; Quick-dry paint label; Indoor paint branding"
"fde0a646-6827-4623-8221-cca0540656b2","Blue Emulsion Paint Can Packaging Mockup White Initial Typography","Paint & DIY","Showcase your paint brand with this elegant blue emulsion paint can packaging design. This versatile mockup features a prominent bold white initial for distinct branding and sleek, modern typography, making it ideal for presenting quick-dry indoor paint products in marketing materials and portfolios.","https://image-brandex.b-cdn.net/images/Paint-Can-11.jpg","emulsion paint can; blue packaging; product mockup; white initial; sleek typography"
"7feee77c-a36c-4a34-a582-98f29ef88b2b","Sports Drink Water Bottle Transparent Plastic Packaging Label Black Mint","Sports & Protein Drinks","This packaging design features a transparent plastic water bottle, ideal for sports beverages and energy drinks. It includes a striking black and mint text label, perfect for branding healthy active lifestyle products.","https://image-brandex.b-cdn.net/images/Multivitamin Drink Bottle greensky 4.jpg","sports drink bottle; plastic packaging; beverage label; black mint color; transparent bottle"
"ef2d28ca-5a69-4fa4-a644-6af8b205d08c","Red Farfalle Pasta Packaging Bag Design","Pasta, Rice & Grains","This vibrant red pasta bag packaging design features striking blue and luxurious gold accents, specifically crafted for farfalle pasta. It is ideal for food brands seeking eye-catching product presentation and high shelf impact in a competitive market.","https://image-brandex.b-cdn.net/images/Pasta Packaging Design 5.jpg","farfalle pasta; red packaging; pasta bag; food packaging design; gold accents packaging"
"e8bc36b9-5a5e-471e-b003-8d9a27414a67","Retro Breakfast Pastry Pop Tart Box Packaging Fun Sprinkles","Breakfast Cereal","This playful retro pop tart box packaging design features vibrant sprinkles and fun patterns, making it perfect for breakfast pastry brands, snack companies, or themed product launches seeking a nostalgic yet modern aesthetic. It offers a cheerful visual appeal for attracting a wide audience.","https://image-brandex.b-cdn.net/images/Pop Tart Packaging 2.jpg","pop tart box; retro food packaging; breakfast pastry; vibrant sprinkles; playful branding"
"7e0b8005-a5e9-47e9-9bd3-32c48a1790f9","Playful Illustrated Pop Tarts Food Packaging Box and Pouch","Breakfast Cereal","This vibrant food packaging design includes a custom box and pouch for pop tarts, featuring playful and colorful illustrations. Perfect for breakfast treats, children's snacks, or any brand aiming for a fun and engaging aesthetic. Easily customizable for your product line.","https://image-brandex.b-cdn.net/images/Pop Tart Packaging 4.jpg","pop tarts packaging; breakfast food box; playful snack pouch; illustrated treat packaging; colorful food container"
"08bb9b8a-e00f-476b-bbff-2b5ec56b77f7","Opaque Green Sports Water Bottle Packaging Sleek Black Label","Sports & Protein Drinks","This product features an opaque green bottle design, perfectly complemented by a sleek black label. It is ideally suited for brands developing premium sports water or other high-end beverage products, ensuring a visually striking presence.","https://image-brandex.b-cdn.net/images/Multivitamin Drink Bottle greensky  2.jpg","sports water bottle; green bottle packaging; black label; beverage container; plastic bottle"
"5f304753-a2a8-4e77-bb3c-cfa679ba94b4","Retro Vibrant Sprinkles Pop Tart Box Packaging Design","Breakfast Cereal","Elevate your breakfast brand with this vibrant retro pop tart box packaging design. Featuring colorful sprinkles and a playful aesthetic, it's perfect for eye-catching food product launches and marketing campaigns. This print-ready design is easily adaptable for various breakfast treats and promotional materials.","https://image-brandex.b-cdn.net/images/Pop Tart Packaging 3.jpg","pop tart box; retro packaging; colorful sprinkles; breakfast food; food packaging"
"5f5d0f4c-9b46-4a74-a60f-206595ddb1c0","Green Gold Classical Bust Silhouette Premium Pasta Packaging Bag","Pasta, Rice & Grains","This elegant green packaging bag features luxurious gold accents and a unique classical bust silhouette, perfect for premium pasta brands seeking a sophisticated presentation that captures attention on shelves.","https://image-brandex.b-cdn.net/images/Pasta Packaging Design.jpg","pasta packaging; green packaging; gold accents; classical bust; food bag"
"a378f3fa-57fe-449d-bc87-ff23e6ab7061","Vibrant Cherry Grape Lemon Candy Bar Packaging Label","Chocolate & Confectionery","This vibrant packaging label is designed specifically for candy bars. It prominently features playful, juicy illustrations of cherry, grape, and lemon fruits. Perfect for artisanal confectioners or small businesses creating unique sweet treats. The eye-catching design ensures your product stands out, appealing to customers looking for fun and fruity flavors.","https://image-brandex.b-cdn.net/images/Refreshing-Candy-6.jpg","candy bar label; fruit candy packaging; cherry flavor packaging; grape flavor packaging; lemon flavor packaging"
"a025b0ad-5ba5-4543-9e25-ea6200cd9805","Purple Paint Can Packaging Design with Turquoise Script for Quick-Dry Emulsion","Paint & DIY","A striking purple paint can packaging design featuring elegant turquoise script. This bold and dynamic design is perfect for quick-dry emulsion products, ensuring high visual impact on shelves. Ideal for branding and product differentiation.","https://image-brandex.b-cdn.net/images/Paint-Can-4.jpg","Purple Paint Can; Turquoise Script; Emulsion Paint Packaging; Quick Dry Paint; Product Label Design"
"1eb52094-3ead-437f-9464-a12c60119cc5","Sleek Black Sports Water Bottle Packaging Label Blue Text","Sports & Protein Drinks","This custom packaging label features a sleek black background with prominent bold blue text, specifically designed for sports water bottles. Perfect for branding and enhancing product visibility in the beverage market, offering a distinct and modern look.","https://image-brandex.b-cdn.net/images/Multivitamin Drink Bottle bluenavey 6.jpg","sports water bottle; packaging label; bottle packaging; beverage container; plastic bottle"
"edb4fcc4-b630-4e0b-91c7-1c6be98b156a","Two-Tone Paint Can Packaging Design Green Yellow Interior Use","Paint & DIY","This bold and modern paint can design features vibrant green and yellow accents, perfect for interior paint branding. It provides a sleek, eye-catching aesthetic for any paint product line, enhancing shelf appeal.","https://image-brandex.b-cdn.net/images/Paint-Can-3.jpg","paint can packaging; two tone colors; green yellow paint; interior paint branding; paint product label"
"5ea2048a-2d0b-43c3-bd5b-6ab7896d487b","Gourmet Pasta Packaging Mockup with Chef Portrait and Farfalle","Pasta, Rice & Grains","Showcase your premium Italian pasta brand with this elegant packaging mockup. Featuring a distinctive chef portrait and detailed farfalle pasta illustration on a sophisticated monochrome background, it's perfect for gourmet food product branding, visual presentations, and marketing materials.","https://image-brandex.b-cdn.net/images/Pasta Packaging Design 11.jpg","chef portrait design; farfalle pasta illustration; monochrome packaging; gourmet food branding; Italian pasta label"
"d833e697-8cdf-47a8-a594-59ffea260d2e","Black Vertical Text Label Clear Sports Water Bottle Packaging","Pharmaceutical & Health","Showcase your vitamin sports water products with this versatile packaging design. It features a sleek clear bottle adorned with a distinctive black label and modern vertical text, perfect for brand mockups. Ideal for presenting your health and wellness beverage brand with a clean, contemporary aesthetic.","https://image-brandex.b-cdn.net/images/Multivitamin Drink Bottle mauvenight  2.jpg","sports water bottle; black label packaging; clear bottle mockup; vertical text label; drink beverage container"
"0cb6787d-ed76-4694-93c9-8d80cd0c46bd","Vibrant Multicolor Fruit Candy Folding Carton Packaging for Breath Mints","Chocolate & Confectionery","These eye-catching folding carton boxes feature vibrant fruit graphics and bold branding. Perfectly designed for sugar-free breath mints, ensuring your product stands out on shelves with a playful and appealing aesthetic. Ideal for confectionery brands targeting health-conscious consumers.","https://image-brandex.b-cdn.net/images/Refreshing-Candy-15.jpg","fruit candy packaging; breath mints box; folding carton; snack container; candy packaging"
"94096fa1-e25b-4100-be05-ef3e03fe74ac","Royal Blue Pasta Farfalle Packaging Bag Classical Art Golden Accents","Pasta, Rice & Grains","Showcase farfalle pasta with this exquisite packaging bag, featuring a rich royal blue base. Adorned with classical art illustrations and luxurious golden accents, it elevates brand identity and ensures a premium shelf presence. Perfect for artisan food brands seeking sophisticated design solutions.","https://image-brandex.b-cdn.net/images/Pasta Packaging Design 3.jpg","royal blue pasta; farfalle packaging bag; classical art style; golden accent details; food product packaging"
"2b411eed-d492-4a28-be2e-8ca5c8c1befb","Whimsical Cow Theme Milk Carton Packaging Design for Dairy Products","Dairy & Milk","This vibrant milk carton packaging design features a whimsical cow wearing glasses, perfect for dairy product branding. Ideal for companies seeking eye-catching and playful beverage packaging that stands out on shelves.","https://image-brandex.b-cdn.net/images/Milk Packaging Design copy.jpg","milk carton packaging; dairy product branding; whimsical cow theme; beverage packaging; farm animal illustration"
"8b820fbb-18b0-4d4f-b903-36751a26e865","Elegant Brown Farfalle Pasta Packaging Greek Classical Style","Pasta, Rice & Grains","Showcase your dry pasta brand with this elegant brown packaging solution. Featuring classical Greek-inspired aesthetics and distinctive farfalle pasta imagery, it's perfect for premium bow-tie pasta products seeking a sophisticated presentation. Ideal for attracting discerning customers.","https://image-brandex.b-cdn.net/images/Pasta Packaging Design 9.jpg","farfalle pasta; brown packaging; Greek style; bow-tie pasta; dry pasta packaging"
"eb2658e7-2630-46f5-8cb6-7bbdf3edee1b","Vibrant Tropical Fruit Candy Bar Wrapper Packaging","Chocolate & Confectionery","This vibrant packaging design features eye-catching tropical fruit graphics perfect for your candy bars and flavored sweets. Ideal for confectionery brands looking to stand out with colorful, appealing wrappers. Easily customizable for various sweet treat products to attract customers.","https://image-brandex.b-cdn.net/images/Refreshing-Candy-12.jpg","tropical fruit packaging; candy bar wrapper; sweet treat packaging; colorful candy wrapper; fruit flavored sweets"
"1127d195-1a2a-4a39-8328-f271b44d2718","Bold Blue Microwave Popcorn Box Packaging with Overflowing Graphic","Snacks & Chips","Vibrant blue microwave popcorn box packaging featuring a dynamic, overflowing popcorn graphic. This design is ideal for snack brands seeking bold, eye-catching shelf presence and strong consumer appeal.","https://image-brandex.b-cdn.net/images/Microwave-Popcorn-2.jpg","microwave popcorn; snack food packaging; popcorn box; food packaging; snack"
"78ce7386-0c88-45eb-a72f-5597c7fa5953","Futuristic Chrome Embossed Cigarette Pack Branding Mockup","Cigarettes, Vape & Gum","Showcase your tobacco brand with this striking futuristic chrome cigarette pack mockup. Featuring intricate embossed lines and a captivating cosmic background, this design is perfect for creating a premium visual identity for your product line. Ideal for marketing materials and portfolio presentations.","https://image-brandex.b-cdn.net/images/QUANTY Cigarettes Inner.jpeg","chrome cigarette pack; futuristic product mockup; embossed packaging; cosmic background; tobacco branding assets"
"1b0ca8a0-89da-4a5b-90f2-923a06f24ef8","Wine Bottle Label Mockup EPS Realistic Presentation","Alcoholic Beverages","Showcase your wine bottle label artwork and branding concepts with this free, high-resolution mockup. Optimized for realistic product presentations, it's perfect for packaging design visualization. Easily editable in Photoshop (EPS file) for designers, brands, and creative studios. Also compatible with AI tools to generate new styles.","https://image-brandex.b-cdn.net/Image/Ready%20Packaging%20Artwork/Rabio%CC%80ha%20Drink%20Packaging.jpeg","wine bottle label mockup; realistic branding presentation; packaging artwork display; beverage container; bottle"
"c645f2bf-adfe-4acc-a174-a17d365bc162","Reakoffs Gum Packaging Mockup Template Vector AI EPS Editable","Chocolate & Confectionery","This editable vector packaging template, designed for Reakoffs, features refreshing Minty Lemon, Orange Lemon, and Grape Lemon flavors. It includes AI and EPS source files, vibrant RGB colors, and 300 DPI print-ready resolution, perfect for showcasing candy, mints, or flavored gum branding.","https://image-brandex.b-cdn.net/image/Poster%20Reakoffs%20Gum%20Packaging.jpeg","gum packaging; candy label; minty lemon; orange lemon; grape lemon"
"4fa0e0f9-6f5c-4ae9-a59a-c7a8173f36bc","Free Gum Tin Packaging Mockup Black Customizable Vector Art","Chocolate & Confectionery","Elevate branding with this free, print-ready packaging mockup. Showcase gum, mints, or candies in a sleek black tin, featuring vibrant, customizable vector artwork. Easily present your food product designs professionally.","https://image-brandex.b-cdn.net/image/Poster%20Reakoffs%20Buzz%20All%20Night%20Gum%20Packaging.jpeg","Gum Tin Mockup; Candy Tin Packaging; Mints Packaging Mockup; Black Tin Mockup; Customizable Vector Packaging"
"552213dd-690d-4c58-8579-e7e013786d4c","Print-Ready Clear Beverage Bottle Packaging Label Mockup Template","Energy & Soft Drinks","Showcase your drinks with this print-ready, customizable beverage bottle packaging mockup. Perfect for soft drinks, juices, or alcoholic beverages, it features clear bottles to highlight your product. This dynamic template includes options for Glow Berry, Zyre Lime, and Citrus Andy flavor profiles, providing a versatile solution for any liquid brand presentation.","https://image-brandex.b-cdn.net/image/Zestflux%20Drink%20Label%20Poster.jpeg","beverage bottle mockup; drink packaging template; product label design; clear glass bottle; editable AI file"
"4f2f711b-4ce0-44ab-b4c5-0082c901dba8","MOTO Candy Tin Packaging Vector Template Editable AI PSD","Chocolate & Confectionery","Highly customizable vector template for MOTO candy, mint, or gum tin packaging. Showcases six refreshing flavors including Peach, Berries Lemon, and Mango. This editable design features vibrant RGB colors, 300 DPI print-ready resolution, and includes both AI and PSD source files for complete branding customization.","https://image-brandex.b-cdn.net/image/Moto%20Mouth%20%26%20breath%20freshener%20Poster.jpeg","candy tin packaging; gum packaging; mint packaging; editable vector; AI PSD template"
"b6bd9ec5-8ff4-4104-8965-b7f9cd3f48c8","MOTO Chewing Gum Packaging Tin Box Vector Mockup 6 Flavors","Cigarettes, Vape & Gum","Showcase your MOTO Chewing Gum packaging with this fully customizable vector mockup. This sleek, square tin box template features six delicious flavors: Strawberry, Berry, Peach, Spearmint, Lemon, and Watermelon. Designed in 300 DPI resolution with RGB color for print-ready projects, it's perfect for visualizing mint or candy tin products. Source files include AI and EPS for complete editing.","https://image-brandex.b-cdn.net/image/Moto%20Gum%20Packaging%20poster.jpeg","chewing gum packaging; tin box mockup; vector packaging file; candy product visualization; mint flavor branding"
"99abfbc5-cb9f-45ac-9534-541478f57a57","VENOM Skull Serpent Packaging Mockup AI EPS Vector","Pharmaceutical & Health","Customize this digital packaging mockup for supplements, energy shots, gum, or tobacco alternatives. Features a unique skull and serpent graphic under the ""VENOM"" brand across three colorways: Teal (Midnight Mint Twist), Red (Ember Citrus Twist), and Green (Evergreen Berries). Provided in AI, EPS, and Vector formats at 300 DPI RGB for print-ready quality, fully editable for color and text.","https://image-brandex.b-cdn.net/image/VENOM%20PAckaging%20Poster.jpeg","Skull Serpent Graphic; VENOM Brand Mockup; Supplement Packaging; Energy Shot Label; AI Vector Format"
"1c7fd872-a1ba-4ad4-81e7-4d420b86a73a","Reno Dath Beverage Bottle Labels Skeleton Character Photoshop","Energy & Soft Drinks","This collection presents three distinct beverage label concepts for the Reno Dath brand. Each label features strong typography paired with dynamic illustrated skeleton characters, injecting energy and personality into any product. Perfect for showcasing soda, craft drinks, or beer, these labels are fully editable in Photoshop. They utilize vector artwork, RGB color, and a 300 DPI print-ready resolution, ensuring high-quality output for your branding projects.","https://image-brandex.b-cdn.net/image/9604572.jpeg","Beverage bottle labels; Skeleton character art; Soda beer packaging; beverage container; bottle"
"48a61d98-e16f-48b4-99bf-45cac7a23968","Roasted Coffee Bag Packaging Design AI PSD Editable Mockup","Coffee","Download this fully editable coffee packaging design in AI and PSD formats. Featuring elegant typography, rich coffee tones, and realistic presentation, it's ideal for showcasing roasted coffee, espresso, or specialty blends. Perfect for designers and brands needing ready-to-use coffee bag templates. Files are high-resolution, print-ready, and organized for easy customization.","https://image-brandex.b-cdn.net/image/Kafenzo%20Coffee%20Bag%20Packaging1.jpeg | https://image-brandex.b-cdn.net/image/Kafenzo%20Coffee%20Bag%20Packaging2.jpeg | https://image-brandex.b-cdn.net/image/Kafenzo%20Coffee%20Bag%20Packaging3.jpeg | https://image-brandex.b-cdn.net/image/Kafenzo%20Coffee%20Bag%20Packaging4.jpeg | https://image-brandex.b-cdn.net/image/Kafenzo%20Coffee%20Bag%20Packaging5.jpeg | https://image-brandex.b-cdn.net/image/Kafenzo%20Coffee%20Bag%20Packaging6.jpeg","roasted coffee bag; espresso packaging; AI PSD files; coffee pouch design; packaging mockup"
"2af4983f-871f-41f5-8953-18daec23b12d","Organic Instant Coffee Jar Product Mockup Rustic Plantation Scene","Coffee","Present your coffee brand with this captivating product photography mockup. It features an elegant glass instant coffee jar with a copper lid and a deep blue label, artfully displayed on a rustic tree stump. The backdrop is a lush coffee plantation with cherry-laden plants, a majestic mountain, and a clear blue sky, providing an authentic and serene setting for showcasing your product.","https://image-brandex.b-cdn.net/image/coffee%20roasters%20.jpeg","instant coffee jar; organic coffee brand; product photography mockup; coffee plantation scene; rustic nature food"
"7b289035-d34c-4ba5-851c-57f440234d70","Cofino Brewing Dark Latte Can – Hand-Held Beverage Lifestyle Mockup","Canned Vegetables & Legumes","A vibrant, high-quality lifestyle image featuring a hand holding a sleek ""Cofino Brewing"" iced coffee can. This variation features a deep purple aesthetic with a modern arched label design, set against a matching soft purple background. This trendy, high-resolution asset is perfect for social media marketing, Gen-Z-targeted beverage branding, and contemporary cafe digital menus.","https://image-brandex.b-cdn.net/images/20.jpg | https://image-brandex.b-cdn.net/images/4.jpg | https://image-brandex.b-cdn.net/images/6.jpg | https://image-brandex.b-cdn.net/images/21.jpg | https://image-brandex.b-cdn.net/images/24.jpg | https://image-brandex.b-cdn.net/images/10.jpg | https://image-brandex.b-cdn.net/images/23.jpg | https://image-brandex.b-cdn.net/images/19.jpg","Purple Beverage Mockup; Canned Latte Lifestyle; Modern Coffee Branding; Aesthetic Product Photography; Hand-Held Can Asset"
"470c1c54-c160-4c14-b429-042382727171","Panther Power Energy Drink – Sleek Matte Black Can Mockup","Energy & Soft Drinks","A premium, high-impact product image featuring a matte black energy drink can with bold ""Panther"" branding and a fierce feline graphic. The asset uses dramatic low-key lighting against a dark, reflective studio background, making it ideal for sports nutrition branding, gaming lifestyle marketing, or high-energy beverage advertisements.","https://image-brandex.b-cdn.net/images/13.jpg | https://image-brandex.b-cdn.net/images/14.jpg | https://image-brandex.b-cdn.net/images/18.jpg | https://image-brandex.b-cdn.net/images/16.jpg | https://image-brandex.b-cdn.net/images/17.jpg | https://image-brandex.b-cdn.net/images/11.jpg | https://image-brandex.b-cdn.net/images/7.jpg","Energy Drink Mockup; Matte Black Can Design; Panther Brand Asset; Sports Beverage Marketing; Dark Studio Product Image"
"c8ea218b-298d-4096-a0fd-aee5deb3d4d4","High-Quality Lemon Tea – Tropical Beach Splash Bottle Mockup","Tea","A high-energy, refreshing product image featuring a bottle of ""Rayton"" Lemon Tea. The asset showcases a dynamic water splash and ice cubes against a sun-drenched tropical beach background. With its vibrant yellow label and ""Fresh Tea Leaf"" branding, this high-resolution image is perfect for summer beverage campaigns, seasonal social media marketing, cafe menus, or travel-themed retail advertisements.","https://image-brandex.b-cdn.net/images/2.jpg","Lemon Tea Mockup; Refreshing Beverage Splash; Iced Tea Beach Photography; drinking beverage container; bottle"
"de883b45-7169-425e-a640-43beab5da264","SPIX 69 Energy Drink – Bold Red & Navy Blue Racing Can Mockup","Energy & Soft Drinks","A high-impact, professional product image featuring the ""SPIX 69"" energy drink can. The design utilizes a dynamic split-color navy blue and red aesthetic with a gold phoenix crest and bold white typography. Shot in a dark studio setting with crisp reflections, this asset is perfect for extreme sports branding, automotive-themed marketing, gaming beverage concepts, or high-energy retail displays.","https://image-brandex.b-cdn.net/images/15.jpg","SPIX Energy Drink Mockup; Racing Style Can Design; High-Performance Beverage Asset; drinking can beverage container; Navy Blue and Red Branding"
"5820f0b3-3fde-40a7-bdcc-81c48d14c32e","Premium Canned Coffee Mockup – Hand-Held Iced Latte Packaging Asset","Canned Vegetables & Legumes","A stylish, lifestyle-focused image featuring a hand holding a sleek ""Cofino"" iced coffee can. The design uses a minimalist white, yellow, and black color block aesthetic, set against a warm, neutral tan background. This high-quality asset is perfect for beverage branding portfolios, social media marketing, cafe menus, or modern retail advertisements.","https://image-brandex.b-cdn.net/images/22.jpg","product packaging; Canned Coffee Mockup; Beverage Lifestyle Photography; Hand Holding Product Asset; Minimalist Can Design"
"4b6d64dc-cde1-424e-b850-9faeee680e6b","Elegant Emerald Green Gift Box – Premium Branding Packaging Mockup","Cosmetics & Personal Care","A sophisticated, high-resolution mockup of a luxury emerald green gift box featuring minimalist white typography. The box is shown at a dynamic tilted angle on a clean, geometric white pedestal, creating a modern and architectural feel. This asset is perfect for high-end retail branding, cosmetic packaging designs, luxury gift catalogs, or corporate identity presentations.","https://image-brandex.b-cdn.net/images/25.jpg","product packaging; branding kit; Luxury Box Mockup; Emerald Green Packaging; Premium Branding Asset"
